id,title,poster_path,poster_caption
1234821,Jurassic World Rebirth,/1RICxzeoNCAO5NpcRMIgg1XT6fm.jpg,"The movie poster presents a dramatic and action-packed scene, vertically composed to draw the eye from a close-up character to a dynamic creature and an expansive natural environment. In the upper mid-ground, a resolute woman with her hair pulled back and a watchful gaze is prominently featured in profile, facing towards the right. She holds a sophisticated, multi-component weapon across her chest, its barrel extending upwards to the left. The lower half of the poster is dominated by a colossal Tyrannosaurus Rex, depicted in mid-stride, bursting from a body of water with powerful splashes, its mouth agape in a fierce roar, conveying immense power and threat. In the bottom right corner, a small inflatable raft carrying several individuals navigates the water, appearing dwarfed and vulnerable in the dinosaur's immediate proximity. The background unfolds with a lush, tropical landscape: a grand waterfall cascades down a rocky cliff on the far left, while on the far right, a towering, rugged rock formation reveals intricate, ancient-looking carvings or structures, suggesting a lost civilization. The sky above is bright and partly cloudy, creating a vast sense of openness.

The lighting throughout the poster is bright and natural, suggesting an outdoor scene bathed in daylight, possibly late morning or early afternoon. The light source appears to be overhead and slightly from the left, illuminating the subjects clearly and casting subtle, yet distinct, shadows that enhance their three-dimensionality and texture, particularly on the T-Rex's rugged skin and the deep crevices of the rock formations. Highlights catch the glistening water splashes, the metallic elements of the woman's weapon, and the edges of her hair.

The overall color palette is rich and earthy, dominated by verdant greens of the dense foliage, varying shades of blue and teal in the water and sky, and warm, textured browns and greys of the rocks and the formidable T-Rex. The woman's attire features muted olive and grey tones, while her futuristic weapon incorporates dark metallic elements punctuated by a bright orange-yellow segment, providing a subtle accent color. The central logo introduces a vibrant gold and deep teal, standing out against the natural backdrop.

The emotional mood conveyed is one of intense adventure, imminent danger, and awe-inspiring scale. The roaring dinosaur and the fleeing raft evoke urgency and fear, while the woman's determined expression and defensive posture suggest courage and readiness for a perilous challenge. The vast, untamed landscape, combined with the mysterious ancient ruins, imbues the poster with an epic and mysterious atmosphere.

Centrally positioned across the poster, overlapping the woman's right arm and positioned above the T-Rex, is the title ""JURASSIC WORLD REBIRTH."" ""JURASSIC WORLD"" is rendered in bold, uppercase, metallic silver lettering with a slight bevel effect, set within a dark rectangular banner, conveying strength and established presence. Below it, ""REBIRTH"" is presented in a slightly smaller, sans-serif, metallic silver font, maintaining a cohesive and modern aesthetic.

The key iconic visual symbol that defines this poster and is instantly recognizable for the franchise is the ""Jurassic World"" emblem itself, which is partially obscured by the woman but prominently displayed above the main title. This circular symbol features a stylized, roaring Tyrannosaurus Rex head and neck in a vibrant golden-yellow silhouette, set against a dark teal-blue background, powerfully encapsulating the essence of the prehistoric creatures at the heart of the story."
1223601,Sisu: Road to Revenge,/jNsttCWZyPtW66MjhUozBzVsRb7.jpg,"This movie poster immediately draws the eye with its intense, dramatic composition, centering on the grizzled, determined face of the main character, Aatami Korpi. He stands prominently in the foreground, looking directly ahead with a formidable scowl and piercing blue eyes that command attention. His strong, weathered hands grip two substantial, dark-barreled firearms, held upright on either side, their stocks resting near his waist and their muzzles extending upward, framing his head and upper torso. Below, the lower third of the poster depicts a chaotic, fiery warzone featuring a menacing tank, explosions, and a barbed wire fence adorned with a red star, suggesting a harrowing conflict. To the lower left, a shaggy, light-colored dog sits, its tongue slightly out, while to the lower right, another man, presumably the antagonist Bruno Helldorf, with an intense expression and an undercut hairstyle, stands partially visible in a reddish-brown jacket. In the mid-ground sky, several small, dark aircraft fly, adding to the sense of aerial combat.

The lighting throughout the poster is stark and dramatic, characterized by strong contrasts and a predominantly warm glow. A powerful light source from the front illuminates the main character's face, highlighting his deep wrinkles, facial scars, and the texture of his full beard, while casting subtle, natural shadows that emphasize his rugged features. The overall scene is heavily back-lit by the intense, fiery explosions and orange-yellow glow emanating from the background, creating prominent rim lighting on the main character's shoulders, the edges of the firearms, and outlining the figures in the lower scene. This strong backlighting contributes to a sense of urgency and danger, with bright highlights contrasting with deeper, rich shadows.

The color palette is overwhelmingly warm and earthy, dominated by rich yellows, fiery oranges, and deep browns that evoke a desert or scorched landscape. The entire background shimmers with intense yellow and orange hues, transitioning into a darker, more muted brown in the foreground elements like the main character's clothing and the wooden stocks of the weapons. The main character's skin tone is sun-beaten and grimy with streaks of reddish-brown, hinting at blood or dirt. Accent colors are sparse but impactful: the striking, almost unnatural blue of Aatami Korpi's eyes, the stark white of the prominent text, and the occasional flashes of red, such as the star on the distant fence, provide vital visual breaks from the prevailing warmth.

The emotional mood conveyed is one of grim determination, relentless resolve, and high-octane action. The main character's intense gaze and powerful stance, coupled with the fiery, explosive background, instill a strong sense of an individual pushed to their limits and embarking on a violent, unforgiving path. There is an unmistakable atmosphere of vengeance and survival against overwhelming odds, with the chaos of war serving as a raw, visceral backdrop to a deeply personal struggle.

Typography is bold, clear, and strategically placed. The title ""SISU"" appears in large, robust, white sans-serif capital letters, centrally positioned across the main character's chest, slightly overlapping his body but remaining distinct and highly legible. Directly beneath it, and in a slightly smaller but equally strong white sans-serif font, the tagline ""ROAD TO REVENGE"" clearly communicates the film's premise. Both text elements stand out sharply against the darker, warm tones of the character's clothing and the lower half of the poster, making them easily readable at a glance.

The key iconic visual symbol that powerfully defines this poster is the **main character's intense, unwavering gaze, framed by the two formidable firearms.** His dirt-streaked, battle-hardened face, crowned by his piercing blue eyes, conveys an unyielding spirit of resilience and an absolute refusal to surrender, encapsulating the very essence of ""Sisu"" against the backdrop of a brutal war."
911430,F1,/vqBmyAj0Xm9LnS1xe1MSlMAJyHq.jpg,"The movie poster presents a dynamic and multi-layered composition, centrally anchored by a determined Brad Pitt in a white racing suit, gazing upwards and slightly to the left, his image dominating a large, central diagonal panel. The entire poster is structured as a sophisticated collage of fragmented images, artfully separated and defined by stark black and thin white diagonal lines that slice across the frame, creating a sense of speed and forward motion. Surrounding Pitt, other characters are seamlessly integrated into smaller, angular segments: a blonde woman with her hands clasped appears in the upper left, an older man in a suit and glasses is positioned to the upper right, a younger man in a tank top occupies a lower-left panel, and another man carrying a duffel bag walks through a sun-drenched stadium segment on the middle right. Below these character panels, a high-speed Formula 1 car hurtles forward on a track, viewed from a low angle, its front wheel prominently featured at the very bottom, while two additional cars race into the distance in a small, upper-right panel.

The lighting throughout the poster is bright and natural, suggesting an outdoor, daytime setting with clear skies. The light source appears to be overhead and slightly to the right, casting soft yet defined shadows that sculpt the faces of the characters, particularly highlighting the contours of Brad Pitt's face and the folds in his racing suit. A warm, golden glow bathes the distant stadium structure and sections of the racetrack, especially prominent around the lower Formula 1 car, creating a sense of aspiration and drama. This natural illumination contributes to an overall clean and crisp visual quality.

The poster’s color palette is dominated by cool tones of blues and grays, evident in the expansive sky and the subtle textures of the racing environments, contrasted with the stark white of Brad Pitt's racing suit and other bright background elements. These cool colors are balanced by warm accents, most notably the natural skin tones of the diverse cast and the golden yellow livery visible on the featured Formula 1 car, along with the soft amber sunlight that illuminates parts of the track and stadium. Black plays a crucial role as an accent color, defining the sharp diagonal lines, the iconic F1 logo, and details on the racing suits and cars, providing strong visual anchors against the lighter background.

An emotional mood of intense determination, high-stakes competition, and aspirational energy pervades the poster. Brad Pitt’s focused gaze conveys a sense of purpose and resolve, while the dynamic, fragmented composition and images of speeding race cars evoke excitement, velocity, and the thrill of the race. There's an underlying atmosphere of professionalism and a dramatic narrative unfolding, suggesting a story rich with ambition and human endeavor within the demanding world of Formula 1.

The typography is strikingly prominent, featuring the bold, sans-serif ""F1"" logo positioned centrally in the lower half of the poster. Rendered in solid black, this iconic symbol creates a powerful focal point, its graphic shapes interacting dynamically with the underlying imagery, slightly overlapping the left shoulder of the man in the tank top and the abstract lines of the racetrack below. Directly beneath it, centered and in a smaller, yet equally clear, sans-serif font, is the phrase ""THE MOVIE,"" also in white, providing immediate context to the F1 branding. The starkness of the black logo against the predominantly lighter background ensures its immediate recognition and impact.

The single most iconic visual symbol that defines this poster is the bold, black ""F1"" logo, which immediately communicates the film's subject matter and genre. Its central placement and striking graphic design are instantly recognizable, serving as the definitive brand identifier for the entire visual narrative."
278,The Shawshank Redemption,/9cqNxx0GxF0bflZmeSMuL5tnGzr.jpg,"The movie poster presents a deeply evocative scene dominated by a lone figure silhouetted against a luminous downpour, establishing a powerful mood of profound liberation. The central subject, a man, is positioned in the upper two-thirds of the vertical frame, with his head tilted sharply backward, gazing directly into the torrential rain and upward light. His arms are outstretched wide, slightly bent at the elbows, with hands open, conveying an embrace of the moment or a gesture of release. This pose, with the figure seemingly emerging from darkness into a cleansing deluge, suggests an overwhelming sense of freedom and catharsis.

The lighting is intensely dramatic, originating from a bright, golden-yellow source positioned high above and slightly behind the figure, creating a striking backlight. This illumination transforms the heavy rainfall into countless streaks of radiant light, cascading diagonally across the frame and highlighting the intensity of the downpour. The man himself is rendered almost entirely as a dark silhouette, particularly his torso and face, with only subtle glints of light catching the edges of his wet clothing and hair, accentuating the deep shadows that define his form. The upper background glows with an almost divine light, a brilliant golden hue, which gradually transitions into richer, darker orange-brown tones as it descends, creating a warm yet solemn color palette. The contrast between the radiant rain and the deeply shadowed figure amplifies the emotional impact.

The overall atmosphere is one of intense emotional release, hope, and spiritual renewal. Despite the dark, almost somber tones of the figure, the overwhelming sense conveyed is one of triumph and breaking free from oppression, underlined by the transformative power of the rain and light. It’s a moment frozen in time that feels both grand and intimately personal.

At the very bottom of the poster, clearly separated from the dynamic upper image, the movie title is presented in clean, white, sans-serif typography. ""THE"" is small and centered above ""SHAWSHANK,"" which is the dominant word, rendered in a larger font with generous letter spacing. Below ""SHAWSHANK"" is ""REDEMPTION,"" also in all capital letters and spaced out, with letters slightly smaller than the main title, aligning with its width. This white text stands out sharply against the deep, almost black background of the poster's lower quarter, anchoring the entire composition without physically interacting with the silhouetted figure above.

The key iconic visual symbol that defines this poster is undoubtedly the silhouetted figure of the man, head thrown back and arms wide open in the torrential, illuminated rain. This powerful image instantly communicates a profound sense of spiritual cleansing, liberation from confinement, and an ecstatic acceptance of a hard-won freedom, serving as a direct and resonant metaphor for the film's central theme of redemption."
19995,Avatar,/gKY6q7SjCkAU6FqvqWybDYgUKIF.jpg,"This movie poster immediately draws the eye with its dramatic vertical composition, seamlessly blending celestial elements, character portraits, and an alien landscape. Dominating the upper half are the large, imposing faces of a blue-skinned Na'vi female on the left, looking directly forward with a piercing gaze, and a human male emerging from the dark on the right, his face partially obscured but also looking intently forward, their features in close proximity. Behind the Na'vi, a large, glowing celestial body casts an ethereal light, while a smaller, darker orb floats further to the left. The mid-section transitions into the fantastical world of Pandora, showcasing iconic floating mountains with delicate waterfalls cascading from their bases, scattered across the horizon. In the lower mid-ground, a magnificent sunrise or sunset bathes the scene in warm hues, silhouetting a Na'vi figure riding an Ikran as it soars across the sky. Distant military-style aircraft are visible flying in formation on the left side of the landscape, adding a subtle hint of conflict.

The lighting throughout the poster is exceptionally dramatic, employing a strong contrast between illuminated subjects and deep shadows. The primary light source seems to emanate from behind and to the left, bathing the Na'vi's face in a vibrant blue glow that highlights her unique features and the bioluminescent dots on her skin, while her right side softens into shadow. The human male's face is sharply lit from the left, emphasizing his rugged contours with bright highlights on his nose and cheekbone, leaving the rest of his face and hair in profound shadow, conveying a sense of gravitas. The lower landscape is equally dramatic, illuminated by the intense, low-angle light of the setting or rising sun, which creates stark silhouettes of the floating mountains and the flying creature against the brilliant sky, while light spills into the valleys, suggesting depth and atmosphere.

The color palette is a masterclass in contrasting cool and warm tones, reflecting the dual nature of the film. The upper half is dominated by a rich array of deep blues, purples, and blacks, from the Na'vi's sapphire skin and her vivid yellow eye to the cool, almost cyan cast on the human's face and the cosmic backdrop. These deep, cool colors evoke mystery and the otherworldly. Below this, the palette shifts dramatically to an explosion of warm oranges, yellows, and fiery reds around the sun, creating a vibrant and energetic landscape. The floating mountains and lush vegetation are rendered in dark, earthy greens and browns, often silhouetted against the bright horizon, providing grounding elements within the fantastical scenery. The transition between these distinct color zones is seamless, creating a harmonious visual flow.

The emotional mood and atmosphere are profoundly epic and filled with a sense of wonder, intensity, and underlying conflict. The juxtaposition of the two faces, both with such focused gazes, conveys a powerful sense of narrative depth, hinting at both confrontation and connection. The luminous elements and the cosmic background instill a feeling of awe and the mystical, emphasizing the alien beauty of Pandora. The dramatic lighting and the scale of the landscape, with its floating mountains and soaring creatures, contribute to an overwhelming sense of grand adventure and the immense stakes involved. There is an undeniable intensity that draws the viewer into the story.

The movie title, ""AVATAR,"" is positioned at the very bottom edge of the poster, serving as a solid anchor for the entire composition. The letters are bold, uppercase, and feature a distinct, almost chiseled serif font. Each letter glows with an inner light, primarily a luminous blue, with brighter highlights along its edges, giving it an ethereal, otherworldly quality as if made of pure energy. This glowing effect creates a subtle halo around each letter, setting it apart from the dark background without appearing detached. The title is perfectly aligned and does not overlap with any visual elements above it, maintaining clear legibility and a sense of deliberate placement.

The key iconic visual symbol that powerfully defines this poster is the striking dual portrait of the Na'vi female and the human male. Their close proximity and intense gazes, despite their obvious physical differences in color and features, immediately symbolize the core narrative of transformation and the profound intertwining of two disparate worlds and beings. This central juxtaposition visually encapsulates the journey and conflict at the heart of the film, making it an instantly recognizable and impactful representation of the ""Avatar"" saga."
76600,Avatar: The Way of Water,/t6HIqrRAclMCA60NsSmeqe9RmNV.jpg,"This striking movie poster for ""Avatar: The Way of Water"" presents a multi-layered composition that blends celestial grandeur with vibrant terrestrial action, unified by a rich color palette and evocative mood.

The upper two-thirds of the poster are dominated by a large, pale blue celestial body, likely a moon or planet, against a deep indigo, star-flecked night sky. Within this ethereal sphere, four prominent Na'vi characters are arranged. The central figure, a male Na'vi with a stern gaze and dreadlocks (Jake Sully), occupies the upper center, flanked by a female Na'vi (Neytiri) to his left, her expression equally resolute. Below them and slightly to the right, a younger female Na'vi (Kiri) looks pensively to the left, while another young male Na'vi (Lo'ak) to her right, with distinctive facial markings, also looks in the same direction. This familial grouping is rendered with intimate detail, their blue skin adorned with luminous patterns.

Transitioning from the cosmic realm, the middle ground erupts into a dynamic ocean scene bathed in the golden hues of either sunrise or sunset. The light source appears low on the horizon, illuminating the scene from behind and slightly to the right, casting a warm, dramatic glow across the turbulent water and distant rock formations. The most prominent feature here is a lean Na'vi rider astride a magnificent, winged aquatic creature, both caught mid-air in a powerful leap from the ocean's surface. The creature's broad, reddish-brown fins are fully extended, glistening with light and spray. Smaller versions of these creatures, some ridden and some unridden, are seen darting through the water and air, creating a sense of exhilarating movement. Jagged, arching rock formations rise majestically from the sea on either side, framing the action, while a flock of birds silhouettes against the luminous sky in the distance.

The lighting throughout the poster shifts dramatically, from the soft, internal glow and subtle celestial illumination on the Na'vi characters in the upper section, which highlights their bioluminescent markings, to the harsh, brilliant backlighting of the ocean scene. Here, sharp highlights catch the spray of water and the edges of the creatures, contrasting with the deep shadows cast by the rocky islands, lending a powerful, almost spiritual quality to the environment.

The overall color palette is a masterful blend of cool and warm tones. Dominant deep blues and teals define the night sky, the characters' skin, and the ocean depths, imparting a sense of mystery and vastness. These are beautifully accented by the vibrant oranges, golds, and fiery reds of the sunrise/sunset sky, the creature's wings, and the illuminated water, infusing the poster with warmth, drama, and energy. The bioluminescent markings on the Na'vi glow with an ethereal light blue.

An emotional mood of epic adventure, familial loyalty, and profound connection to the natural world pervades the poster. The resolute expressions of the Na'vi, coupled with the breathtaking scale of their world and the exhilarating action of the water creatures, evoke a sense of wonder, impending conflict, and a powerful call to explore the unknown.

At the very bottom, the typography for the movie title is integrated directly into the seascape. The word ""AVATAR"" is rendered in a prominent, angular, and somewhat crystalline blue font, stretching across the width of the poster. Its letters appear to be partially submerged in the dark, undulating ocean water, creating a subtle, shimmering reflection effect. The distinctive ""A"" in ""AVATAR"" incorporates a unique, tribal-like symbol within its structure. Directly beneath this, the subtitle ""THE WAY OF WATER"" is presented in a smaller, clean sans-serif font, also in a light blue or white, positioned just above the waterline.

The most defining iconic visual symbol that encapsulates this poster's essence is undoubtedly the **Na'vi rider atop the large, winged aquatic creature, mid-leap from the tumultuous ocean.** This dynamic image powerfully communicates the film's core theme of the deep connection between the Na'vi and Pandora's marine ecosystem, explicitly referencing ""The Way of Water"" and promising thrilling aquatic journeys."
