id,title,poster_path,poster_caption
755898,War of the Worlds,/yvirUYrva23IudARHn3mMGVxWqM.jpg,"The movie poster is dominated by the intense gaze of a man, identified as Ice Cube, who occupies the central and lower-mid portion of the image. His face is framed by dark-rimmed glasses, and he sports a full, dense beard and close-cropped, curly hair. He looks directly forward with a serious, unwavering expression, conveying deep focus and perhaps a sense of foreboding or determination. His shoulders and the upper part of his chest are visible, clad in what appears to be a dark, textured sweater or jacket, blending into the lower darkness of the poster.

Behind and around the man's head and upper body, a striking mosaic of predominantly grayscale, grainy images forms the background, creating a collage effect. These smaller panels depict various scenes and symbols, many suggestive of the film's themes: menacing, tall alien tripods are seen across several panels, some looming over familiar landmarks like the Capitol Building; other panels show glimpses of people, what appears to be police activity or surveillance footage, a stark ""DATA LOSS ALERT"" graphic, and areas of television static. This fragmented background hints at a chaotic, technologically-driven, and globally impacted conflict.

The primary light source appears to be directed from slightly above and in front of the man, casting subtle but defined shadows beneath his brow, nose, and chin, which accentuate the rugged textures of his face and beard. The reflections in his glasses create small, bright specular highlights, suggesting a screen or light source in front of him. The background elements are lit variably, consistent with their implied origins as surveillance, news footage, or archival imagery, contributing to the poster's overall dark and serious quality.

The overall color palette is strikingly somber, dominated by deep blues, grays, and blacks. The man's attire and the predominant background tones settle into these darker hues. His skin tone introduces a warm, rich brown, contrasting subtly with the cooler grays of the surrounding imagery. The most prominent accent color is a luminous, electric blue used for the movie title at the bottom.

The emotional mood conveyed is one of intense seriousness, vigilance, and perhaps an undercurrent of dread or critical thought. The man's direct and stern gaze immediately draws the viewer in, suggesting he is either observing or directly confronting the unfolding events depicted in the background. The chaotic, fragmented imagery of the background further amplifies a sense of global crisis and impending doom, creating an atmosphere that is both suspenseful and dramatic.

The movie title, ""WAR OF THE WORLDS,"" is positioned prominently at the bottom center of the poster. The typography is a bold, sans-serif font rendered in a glowing, almost metallic blue, making it stand out sharply against the dark foreground. The words ""WAR OF THE"" are stacked, with ""THE"" being smaller and placed below ""OF."" Most notably, the letter ""O"" in ""WORLDS"" is ingeniously replaced by a detailed, softly glowing orb of Earth, subtly illuminated with a blueish light, adding a powerful thematic element directly into the title. The text is completely separate from the man, sitting beneath him, grounding the composition without obscuring his presence.

The key iconic visual symbol that defines this poster is undoubtedly the **Earth orb replacing the 'O' in ""WORLDS""** within the title itself. This clever integration immediately communicates the global scale of the conflict, making the classic title uniquely resonant with the visual themes of invasion and planetary stakes."
1311031,Demon Slayer: Kimetsu no Yaiba Infinity Castle,/fWVSwgjpT2D78VUh6X8UBd2rorW.jpg,"This intensely dynamic movie poster features a multi-layered composition, drawing the viewer into a pivotal confrontation with an aggressive, upward-sweeping diagonal flow. At the top left, the demon Akaza dominates with a fierce, wide-eyed snarl, his striking pink hair and pale blue facial markings standing out against a backdrop of swirling, radiant blue energy that seems to emanate from his powerful form. His body is twisted in a powerful, action-ready pose, with prominent muscles highlighted by the electric blue glow. Slightly above and to his right, Giyu Tomioka is depicted with an equally intense, grimacing expression, his dark hair flowing as he, too, is enveloped in streams of bright blue, water-like energy, indicating a powerful attack or defense. His gaze is directed downwards and to the right, towards the primary protagonist.

The lighting throughout the poster is dramatic and highly contrasted, sharply delineating the forms and creating a palpable sense of energy. Cool, vibrant blues and purples illuminate Akaza and Giyu, casting strong highlights and deep shadows that emphasize their musculature and the intricate details of their attire. In stark opposition, the lower right section of the poster is bathed in a searing, warm palette of fiery oranges, reds, and yellows, emanating from the determined figure of Tanjiro Kamado. The primary light sources appear to be the elemental powers themselves, creating a battleground split by opposing energies. Shadows are pronounced and contribute to the poster's high contrast and urgency, especially on Tanjiro's face and clothing, where they deepen the folds and textures amidst the intense glow.

The overall color palette is a striking dichotomy of cool and warm. Dominant vibrant blues, electric purples, and deep indigos define the upper and left sections, creating an icy, powerful aura around Akaza and Giyu, subtly revealing the complex, dark architectural structures of the Infinity Castle in the distant background. This cool spectrum sharply contrasts with the fiery oranges, crimson reds, and bright yellows that engulf Tanjiro and the lower right portion of the poster, suggesting intense heat, power, and perhaps Sun Breathing techniques. Accent colors include the bright pink of Akaza's hair, the pale blue of his markings, the various greens and browns of Tanjiro's haori and uniform, and the dark tones of the characters' hair, providing depth and specificity within the dominant color fields.

The emotional mood conveyed is one of extreme intensity, urgent conflict, and high-stakes battle. Each character's expression—Akaza's aggressive snarl, Giyu's focused fury, and Tanjiro's determined, strained roar—communicates an immense struggle and an unyielding will. The dynamic diagonal composition, combined with the swirling elemental effects and the powerful poses, creates an atmosphere of relentless action and impending climax. The poster exudes a sense of epic confrontation, with the fate of the moment hanging precariously in the balance, underscored by the explosive energy radiating from all sides.

The typography is integrated seamlessly into the lower central portion of the poster, acting as a grounding element amidst the chaotic energy. ""THE MOVIE"" is positioned in a relatively small, stark white, blocky font at the very bottom left corner, just above the main title. ""KIMETSU NO YAIBA"" appears in a smaller, white, elegant font above the much larger, prominent title ""DEMON SLAYER,"" which is rendered in bold, white, capitalized serif letters with distinct serifs and a slight volumetric effect. This main title spans across the lower center, partially obscuring the elemental effects but remaining clearly legible. Directly beneath ""DEMON SLAYER"" is ""INFINITY CASTLE,"" emblazoned in a vibrant, slightly distressed red font, creating a powerful visual anchor. The placement of the titles respects the dynamic flow of the character action, with the text interacting directly with the swirling blues and fiery oranges, suggesting the title is intrinsically part of the battle's energy.

The key iconic visual symbol that defines this poster is the intense, elemental clash of opposing energies, prominently displayed as a radiant blue wave on the left converging with an erupting fiery orange current on the right. This powerful visual metaphor not only showcases the distinct powers of the combatants but also bisects the poster, symbolizing the fundamental conflict and the immense forces at play in a vivid, almost tangible way."
1317288,Marty Supreme,/lYWEXbQgRTR4ZQleSXAgRbxAjvq.jpg,"This striking movie poster presents a tight, dynamic portrait of a young man, capturing a moment of intense focus and exertion. The subject, positioned slightly to the right of the central axis, fills the frame from his chest upwards, looking intently with an upward and slightly leftward gaze that follows his line of sight to the viewer's upper left. His head is tilted slightly, emphasizing the angle of his stare, and his mouth is agape, suggesting a gasp, shout, or heavy breath. The background is softly blurred into an indistinct, dark expanse, ensuring all attention remains on the central figure.

The lighting is dramatic and directional, emanating strongly from the upper left, casting a brilliant highlight across the man's forehead, the bridge of his nose, and the contours of his right cheekbone. This intense light emphasizes the wetness of his dark, swept-back hair, which glistens with moisture, and the sheen of sweat on his skin, particularly noticeable on his shoulder and collarbone. Deep, soft shadows fall naturally on the left side of his face and beneath his chin and jawline, adding definition and a sense of three-dimensionality to his features, enhancing the mood of strenuous activity.

The overall color palette is dominated by warm, earthy tones, anchored by the man's tanned skin, which takes on shades of golden brown under the strong light. The muted background consists of indistinct dark browns and greys, providing a subtle contrast to the vibrant subject. His simple white tank top offers a stark, clean accent against his skin and the darker backdrop. Further delicate color accents are found in the subtle greenish-blue hue of his eyes, the thin gold frames of his distinctive octagonal glasses, and the slender gold chain around his neck. The title text, however, is a bright, reflective metallic silver, catching the light vividly.

An intense and determined emotional mood permeates the poster, underscored by the man's focused gaze and open mouth, which conveys a sense of being caught mid-action or immersed in a profound moment. The sweat and taut expression communicate physical exertion and a serious, perhaps urgent, atmosphere. There is an undeniable sense of raw energy and concentration, suggesting a story of struggle or triumph.

The typography for the title, ""MARTY SUPREME,"" is robust and prominent, rendered in a bold, sans-serif font with a luxurious metallic silver finish that gleams under the implied light source. ""MARTY"" is presented in significantly larger letters than ""SUPREME,"" which is stacked directly beneath it. Both words are horizontally centered and occupy the lower middle third of the poster, partially overlapping the man's white tank top and the lower part of his chest. This placement allows the text to integrate with the subject without obscuring his face or upper body, while still drawing attention to itself. The text also appears to slightly obscure a golden-orange object, possibly a stick or pencil, held or worn by the subject on his lower right side.

The key iconic visual symbol that defines this poster is undoubtedly the man's unique octagonal glasses, combined with his intense, sweat-slicked gaze. These unusually shaped spectacles immediately draw the eye and imbue the character with a distinctive, slightly quirky intellectualism that contrasts with his physically strenuous appearance, making him instantly recognizable and memorable, hinting at a complex personality behind the determined facade."
858024,Hamnet,/vbeyOZm2bvBXcbgPD3v6o94epPX.jpg,"The movie poster for ""Hamnet"" presents a deeply intimate and evocative scene, drawing the viewer into a lush, natural world. At its core, the composition features two figures, a woman and a man, depicted in a close embrace, their heads gently touching as if finding solace or deep connection. The woman is positioned slightly to the left and foreground, her face serene with eyes closed, resting her head against the man's shoulder. The man, positioned slightly behind and to the right, leans into her, his eyes cast downwards in a gesture of contemplation or quiet affection, his arm loosely wrapped around her. They are central to the frame, yet profoundly embedded within a dense tapestry of vibrant greenery and wild flora that completely surrounds them, creating a secluded and timeless tableau.

The lighting is soft and natural, suggesting dappled sunlight filtering through an overhead canopy of leaves. It casts gentle highlights on the woman's brow, cheekbone, and the crown of her hair, while subtle shadows define the contours of her face and neck. The man's face and hair are similarly illuminated, with soft light catching the texture of his beard and the fabric of his clothing, while the surrounding foliage exhibits varying degrees of light and shadow, giving depth and texture to the dense environment. There are no harsh contrasts, contributing to the overall gentle and organic feel.

The color palette is rich and earthy, dominated by deep and varied shades of green from the abundant leaves and plants. These greens range from muted sage to darker forest hues, forming a natural frame and backdrop. The woman wears a warm, rust-red or deep terracotta-colored garment, providing a strong, grounded accent against the verdant setting. The man's clothing is a cooler, muted blue-green or teal, subtly contrasting with the woman's warmth and blending harmoniously with the greens around him. Small touches of accent colors appear within the foliage: delicate white and yellow blossoms, a sprig of purple lavender towards the bottom right, and the striking dark reddish-brown and black of a hawk in flight, its wings outstretched, adding a dynamic, wild element to the lower right corner.

An overwhelming sense of tranquil intimacy and profound connection permeates the poster. The atmosphere is one of quiet contemplation and shared solace, evoking a feeling of deep, perhaps even sorrowful, love and belonging within the natural world. It feels both ancient and deeply personal, suggesting a narrative rooted in emotion and the rhythms of nature.

The title ""HAMNET"" is prominently displayed in a classic, elegant serif font, colored in a light, almost cream or off-white hue that stands out against the darker, natural tones. It is positioned centrally at the bottom of the poster, resting just above the foreground foliage. The letters are clean and well-defined, yet they feel subtly integrated with the organic environment, as if growing from the earth itself, with the lower parts of the letters occasionally interacting directly with the tips of leaves and stems.

The key iconic visual symbol that defines this poster is the deeply intertwined embrace of the two figures, utterly enveloped by and almost merging with the wild, untamed nature surrounding them. This powerful image of human connection existing in profound harmony and solitude within a vibrant, living landscape conveys both the personal story and its broader, natural context, suggesting themes of life, death, and enduring love deeply rooted in the earth."
9276,The Faculty,/5XetJwmAiDC0EtH23NIXaqFn3Wl.jpg,"This captivating movie poster is dominated by a stark, unsettling atmosphere, drawing the viewer into a world of impending dread and mystery. Six young individuals, their faces etched with a blend of apprehension and determination, populate the lower and right portions of the frame, presented in a staggered, overlapping arrangement. The face of a young man, partially cropped, commands the far right foreground, his intense gaze fixed outward. To his left, the faces of another young man, a blonde-haired woman, a second young man, another woman with lighter hair, and a dark-skinned young man on the far left, are angled and illuminated, suggesting a shared, perilous focus. In the upper background, a traditional-looking school building, identified by a banner proclaiming ""WELLINGTON HIGH SCHOOL CLASS OF 1999,"" stands ominously under a vast, star-speckled night sky.

The lighting is intensely dramatic and serves to heighten the poster's eerie mood. A powerful, cool blue luminescence emanates from an unseen source, sharply outlining the contours of the students' faces and shoulders, creating stark contrasts between illuminated planes and deep, inky shadows that obscure much of their bodies and the lower parts of the image. This blue light also bathes the school building, which is further accentuated by an unsettling red glow at its base, hinting at a malevolent presence. From the school's roof, a brilliant, piercing white-blue beam of light shoots vertically into the night sky, its power palpable.

The overall color palette is strikingly dark and mysterious. Deep blacks and intense, shadowy blues dominate the background and the students' attire, establishing a somber and foreboding tone. These dominant dark hues are dramatically accented by the electric blue light casting an otherworldly glow on the subjects, the fiery red emanating from the school's base, and the stark white brilliance of the ascending light beam. These sharp contrasts underscore the unnatural events unfolding within the scene.

An overwhelming sense of paranoia, suspicion, and urgent danger permeates the poster. The intense, often wary expressions on the students' faces, coupled with the unsettling blue and red lighting, convey a feeling that they are caught in a grave and perhaps alien predicament. The isolated school under a cosmic beam of light further amplifies the atmosphere of a terrifying, otherworldly invasion targeting a seemingly ordinary high school, instilling a mood of sci-fi horror and desperate struggle.

At the bottom center, the movie title, ""THE FACULTY,"" is displayed prominently in a bold, white, sans-serif uppercase font. The word ""THE"" is smaller and placed directly above the uniquely stylized ""A"" in ""FACULTY."" This capital ""A"" is notably distinctive, forming an inverted V-shape that mirrors the iconic light beam originating from the school, making the typography an integral part of the visual narrative.

The singular, most defining visual symbol of this poster is the towering, incandescent beam of light that erupts from the roof of the high school building. This brilliant pillar of energy ascends into the dark, starry expanse above, its intense white core flaring into shades of blue and red as it widens, unmistakably signaling an extraordinary and terrifying event of cosmic proportions originating from within the confines of the school itself."
207933,Stonehearst Asylum,/fZxGCCQ0NAtraevqULJ84wSSjo0.jpg,"The movie poster presents a captivating and unsettling duality, split horizontally by the film's title, creating a distinct upper and lower realm. In the upper half, four central figures dominate the foreground, arranged in a slight arc within a warmly lit, opulent interior that features ornate architectural details and subtle busts in the background, hinting at a grand, perhaps institutional, setting. A woman, centrally positioned and slightly forward, gazes directly and intensely at the viewer, her expression serious. To her immediate left, an older man with a white cravat looks forward, while further left, another older man in a lab coat or similar attire holds a small, dark object, his gaze directed slightly to his right. To the central woman's right, a younger man with spectacles looks off to his right.

The lighting in this upper section is warm and dramatic, emanating from the front and subtly from behind, casting soft highlights on the characters' faces and clothing, defining their forms without harsh shadows. The color palette here is rich with deep, earthy tones—dominant golds, warm browns, and muted ochres in the background and men's attire. The central woman's dress provides a striking accent in a deep, lustrous teal or dark turquoise, contrasting elegantly with the surrounding warmth. The men's clothing incorporates crisp whites, dark vests, and a prominent maroon sash or tie on the leftmost figure.

Running across the center of the poster, acting as a stark horizontal divider between these two worlds, is the film's title: ""STONEHEARST ASYLUM."" Rendered in a majestic, ornate serif font, the letters possess a three-dimensional, carved quality, appearing as if crafted from antique gold or brass. This metallic typography is framed by subtle horizontal bars, giving it the appearance of an institutional plaque or a significant architectural element, firmly grounding it in the visual narrative and serving as a pivotal threshold.

Below this title lies the poster's defining iconic visual symbol: an inverted, deeply distorted, and spectral reflection of the upper scene. The characters' faces and forms appear upside down, submerged in a murky, cold, and shadowed environment. This lower half is dominated by a chilling color palette of deep, desaturated blues, grays, and near-blacks, suggesting a watery abyss or a ghostly realm shrouded in fog. The reflection of the central woman, with her hair appearing darker and more disheveled, stares out with an unnerving intensity, while the reflected men appear more blurred and ominous. Faint outlines of a gloomy, silhouetted cityscape or the asylum's architecture emerge from the darkness beneath these inverted figures.

The overall emotional mood is one of profound mystery and psychological tension, underscored by an unsettling gothic atmosphere. The upper half, with its dignified yet serious figures, hints at hidden secrets within a structured world, while the inverted, spectral reflections beneath the title plunge the viewer into a realm of madness, the supernatural, or a disturbing hidden reality, creating a powerful sense of foreboding and duality."
1534,Pathfinder,/mME7efKNTU7jzXTgFkI1t0aQUiz.jpg,"The poster is dominated by a chillingly desaturated teal and deep blue-green color palette, immersing the viewer in a tumultuous, watery world. At its heart, a ferocious struggle unfolds between two primary figures. On the left, a lean, indigenous-looking warrior, clad in simple garb and adorned with feathers, lunges forward with a spear, its tip aimed at a formidable adversary. Facing him is a towering, heavily armored figure, almost monstrous in its bulk, draped in what appears to be fur or tattered pelts, its helmet adorned with horns. This larger antagonist is caught in a powerful, menacing stance, a massive axe or bladed weapon clutched in its hand, about to strike.

The composition places this epic clash centrally, with the smaller warrior positioned dynamically against the larger, darker form of his foe, creating a stark contrast in size and agility. Behind and above this immediate confrontation, partially shrouded in mist and spray, looms the distinctive silhouette of a Viking longship, its ornate, dragon-headed prow rising sharply towards the turbulent, cloud-filled sky. The lower portion of the poster features swirling water and obscured debris, hinting at the violent environment of the battle.

Dramatic and ethereal lighting emanates from an unseen source high above, casting a stark, almost supernatural glow on the figures and the churning water, particularly highlighting the crests of waves and the outlines of the characters. This illumination sharply contrasts with the deep, oppressive shadows that define the monstrous bulk of the armored figure and the depths of the stormy sky, creating a strong sense of three-dimensionality and foreboding. The overall effect is one of a wet, windswept battle taking place under a grim, overcast sky.

The prevailing color palette is a range of cold, desaturated aqua and deep sea green, transitioning into near-black at the top and bottom edges. Lighter, more vibrant turquoise tones are visible in the breaking waves and atmospheric mist around the combatants, providing pockets of eerie brilliance against the dominant gloom. The only significant deviation from this cool spectrum comes from the title typography, offering a subtle, ancient metallic warmth.

An intensely grim and epic atmosphere pervades the poster, evoking a sense of ancient conflict, desperate struggle, and raw violence. The stormy environment, the ferocity of the combatants, and the looming presence of the longship combine to create a mood that is simultaneously thrilling, perilous, and darkly mysterious. There is a palpable tension and a feeling of immense stakes within this primal confrontation.

Positioned at the very bottom, centered against the dark void of the lower canvas, is the movie title ""PATHFINDER"". The typography is rendered in a stylized, weathered gold or bronze, with an aged, metallic texture that suggests ancient craftsmanship or battle-worn artifacts. Each letter possesses a unique, almost hand-carved quality, contributing to the poster's historical and rugged aesthetic, standing out vividly against the deep black and dark teal tones without obstructing the main imagery.

The key iconic visual symbol that powerfully defines this poster is the **Viking longship's dragon-headed prow**. It unmistakably sets the historical and cultural context of the conflict, towering in the background as a silent, formidable witness to the brutal struggle, directly linking the characters and their battle to a specific era and mythology."
