id,title,poster_path,poster_caption
425274,Now You See Me: Now You Don't,/oD3Eey4e4Z259XLm3eD3WGcoJAh.jpg,"The movie poster presents a captivating visual puzzle, immersing viewers in a world of illusion and intricate design. Its composition arranges multiple characters across a seemingly impossible, labyrinthine structure of stairs and platforms, evoking the M.C. Escher style of impossible architecture. At the top left, a man in a brown leather jacket and jeans stands casually, while directly across from him on the right, another man in a dark blue blazer holds a small object, his gaze directed forward. Centrally positioned and dramatically upside down, a woman in a light-colored suit hangs suspended from what appears to be the ceiling, her hair falling towards the ground. Below her and to the left, an older gentleman in a striking red velvet jacket and black hat poses thoughtfully, hands in his pockets. Adjacent to him, a woman in a dark velvet blazer and trousers stands confidently with a hand on her hip. Further to the right and slightly lower, a young woman in a black leather jacket and jeans stands relaxed, looking towards the viewer. Finally, at the very bottom, two more men complete the ensemble: one on the left in a plaid blue jacket and hat, and another on the right in a dark suit, positioned partially in front of the film’s title. The characters are scattered across different levels and orientations of the architectural maze, suggesting a complex interplay between them and their environment.

The poster is bathed in a cool, soft ambient light that seems to emanate from an unseen source above, casting gentle, diffused shadows that define the edges of the stairs and platforms without creating harsh lines. These subtle shadows enhance the three-dimensional depth of the intricate architectural backdrop, making the white and light blue-grey surfaces of the stairs appear luminous and almost otherworldly. The lighting highlights the characters evenly, ensuring their details are clear, while the background recedes into deeper blue tones in the more distant, lower sections of the stairwells, adding a sense of infinite complexity and mystery.

The overall color palette is predominantly cool, dominated by varying shades of light blue, grey, and white that compose the expansive, stylized staircase environment. These cool tones create a crisp, clean, and somewhat ethereal atmosphere. Accent colors are introduced primarily through the characters' attire, offering splashes of warmer tones such as the rich brown of the leather jacket, the deep red of the velvet blazer, and the lighter blue of jeans. Darker shades of navy and black in other characters' suits and jackets provide contrast and grounding within the cool, bright setting.

An emotional mood of profound mystery and intellectual intrigue pervades the poster. The impossible architecture immediately suggests themes of illusion, misdirection, and a reality that is open to interpretation, mirroring the essence of magic. The characters, with their diverse poses and generally serious or contemplative expressions, contribute to an atmosphere of sophisticated playfulness mixed with an underlying seriousness. There's a sense of being part of an elaborate, grand spectacle, where perception is key and nothing is quite as it seems.

The typography is a crucial element, centrally placed at the bottom of the poster. The main title, ""NOW YOU SEE ME,"" is rendered in a sleek, bold, sans-serif font with a metallic, reflective finish, giving it a modern and polished look. Directly below it, and strikingly inverted, is the phrase ""NOW YOU DON'T,"" echoing the visual theme of reversal and illusion. The inverted text is positioned so that the character at the bottom right, a man in a dark suit, stands just in front of it, subtly interacting with the letters. The combination of the upright and inverted text acts as a direct verbal articulation of the poster's visual narrative, emphasizing the film's core concept of magic and disappearance.

The most key iconic visual symbol that defines this poster is the interconnected, impossible architecture of the staircases and platforms. This Escher-esque labyrinth, with its perpetual and ambiguous pathways, perfectly embodies the film's themes of illusion, perception, and the bending of reality. It serves as a literal and metaphorical stage for the characters, hinting that their actions and identities are deeply intertwined with a world designed to deceive and amaze, where every turn presents a new perspective or trick."
24428,The Avengers,/RYMX2wcKCBAr24UyPD7xwmjaTn.jpg,"This dynamic movie poster for ""The Avengers"" thrusts viewers into a scene of intense urban warfare, dominated by a formidable assembly of heroes poised for action amidst a crumbling cityscape. At the very forefront and slightly to the right of center, Iron Man, portrayed by Robert Downey Jr., lunges forward, his left arm extended dramatically, the palm of his gauntlet glowing with a vibrant blue repulsor energy that projects directly towards the viewer. His pose establishes a strong diagonal line that draws the eye into the heart of the action. Behind him and to his left, the massive green form of the Hulk strides purposefully, his powerful physique and grimace hinting at immense destructive power. Further back on the left, Hawkeye, with his bow drawn and an intense gaze, stands ready, subtly shadowed but focused.

Arranged behind Iron Man and extending towards the right, the remaining heroes complete the heroic ensemble. Captain America stands tall, resolute, his iconic shield firmly in hand, positioned with a steadfast posture. Beside him, Thor holds Mjolnir, his legendary hammer, at his side, his long blonde hair and serious expression conveying godly might. Slightly recessed but still prominent, Black Widow assumes a confident stance, ready for combat, while Nick Fury stands stoically further back, a commanding presence observing the unfolding chaos. The characters are strategically layered, creating depth and a sense of a unified front, with Iron Man most prominent due to his forward reach and central placement. The background features a sprawling, partially destroyed city, with iconic structures like the Stark Tower prominently displaying its name, topped by a luminous, vertical beam of blue energy piercing the sky. Explosions erupt from various buildings, spewing debris and fire into the turbulent atmosphere, with a shadowy alien craft contributing to the sense of aerial assault.

The lighting throughout the poster is dramatic and multi-directional, masterfully sculpting each character and highlighting the chaos of the scene. Strong, cool blue and teal tones dominate the sky and much of the ambient light, particularly from the glowing energy beam atop Stark Tower and Iron Man's repulsor, which casts bright blue reflections. This cool light is sharply contrasted by intense warm oranges and yellows emanating from fiery explosions in the background, creating a visually striking interplay of hot and cold. Deep shadows add a gritty realism and intensity, enhancing the heroic yet perilous atmosphere, with light catching edges and contours to emphasize musculature and suit details.

The overall color palette is a compelling blend of deep, muted blues, teals, and grays that define the urban battlefield and ominous sky, serving as the dominant backdrop. These cool tones are punctuated by vivid accent colors: the fiery reds and metallic golds of Iron Man's suit, the vibrant green of the Hulk's skin, Captain America's bright red, white, and blue shield, and Thor's crimson cape. The glowing blue energy elements provide an additional, dynamic accent, drawing the eye to key points of power and action.

An emotional mood of urgent heroism and epic confrontation permeates the poster. The characters' determined expressions, dynamic poses, and the clear signs of devastation – crumbling buildings, explosions, and debris-strewn foreground – convey a sense of high stakes and impending battle. There is a palpable atmosphere of unity in the face of overwhelming odds, suggesting a collective resolve to protect. The scene feels alive with energy, danger, and the promise of a spectacular conflict.

The typography for the film's title, ""THE AVENGERS,"" is prominently positioned across the bottom third of the poster. ""THE"" is rendered in a smaller, metallic font, nestled above and slightly to the left of the large, impactful ""A"" in ""AVENGERS."" The main title font is bold, robust, and appears to be crafted from a chiseled or weathered metallic material, hinting at strength and resilience. The letters are slightly distressed, subtly interacting with the surrounding rubble and debris upon which they rest, visually grounding the title within the chaotic environment.

The singular most iconic visual symbol that defines this poster is the **stylized ""A"" in ""AVENGERS""**, which ingeniously incorporates an arrow pointing to the right. This iconic emblem, known as the Avengers logo, is not just a letter but a powerful visual representation of the team's identity and their unified forward momentum. It encapsulates the essence of the heroes coming together under one banner to face a common threat, serving as an unmistakable symbol of the franchise itself."
26725,Nomads,/rqPl4jsFmBvl2odkYHtUeTqBCjT.jpg,"The poster for ""Nomads"" immediately establishes a compelling juxtaposition between the earthly and the ethereal. In the foreground, dominating the lower two-thirds of the image, stands Pierce Brosnan, caught in a dynamic mid-stride, moving towards the viewer's left but turning his head to lock eyes directly with the audience with a serious, intense gaze. He wears a dark leather jacket over a crisp white button-down shirt and light-colored pants. Below him, stretching across the bottom, is a dark, expansive cityscape dotted with countless warm, twinkling lights, suggesting an urban sprawl at dusk or night, with a solitary, dark palm tree visible on the right horizon. Above and behind Brosnan, the upper two-thirds of the poster dissolve into a swirling, cool blue mist from which spectral figures emerge. The most prominent is a large, central female face with wide, intensely glowing white eyes and a dramatically open, screaming mouth, positioned in the upper center. To her right and slightly lower, another smaller, similarly anguished female face is visible. Numerous elongated, translucent hands with glowing fingertips reach out from the blue haze, some appearing to stretch towards the man below, creating a palpable sense of otherworldly pursuit and menace.

The lighting throughout the poster is strategically employed to delineate these two realms. Pierce Brosnan is sharply lit from the front-right, creating clear highlights on his right cheekbone, shoulder, and the front of his clothing, while casting distinct shadows on the left side of his face and body, grounding him with a tangible, three-dimensional presence. In stark contrast, the ghostly figures above appear almost self-luminous, emanating a cool blue internal glow without casting any hard shadows, thus emphasizing their ethereal, non-physical nature. The sky behind Brosnan transitions dramatically from a vibrant purplish-pink at the horizon line, suggesting a powerful twilight, to a deep, intense indigo-blue that dominates the upper portion where the spectral figures reside. The overall color palette is anchored by this dominant cool blue and purple in the supernatural upper half and horizon, strikingly contrasted by the warmer, earthly tones of Brosnan's dark brown leather jacket and the crisp white of his shirt. Accents of piercing glowing white from the ghosts' eyes and mouths, along with the numerous small, warm yellow-orange pinpricks of light from the distant city, add vivid points of interest.

An immediate and profound sense of unsettling mystery and supernatural dread permeates the atmosphere of the poster. Brosnan's direct, unwavering gaze, coupled with his dynamic pose, conveys an urgent awareness of an unseen, ominous presence. The screaming, ethereal faces and the elongated, grasping ghostly hands evoke an immediate sense of fear and the uncanny, strongly hinting at a relentless, otherworldly pursuit. The dark, sprawling cityscape beneath the dramatic, shifting sky reinforces a feeling of isolation and vulnerability, further intensifying the suspense. The combined effect is an intense, supernatural thriller mood, where the conventional world is clearly being encroached upon by potent, spectral forces, creating an atmosphere of urgent, chilling uncertainty.

The film's title, ""NOMADS,"" is prominently centered at the very bottom edge of the poster, serving as a clear and stable anchor to the entire composition. It is rendered in a highly stylized, elegant serif font, distinguished by its slightly sharp terminals and a refined, almost gothic aesthetic. The text itself appears luminous, with a gradient transition from a deep blue to a rich purple, directly echoing the supernatural hues present in the sky above. A bright, sharp white inner glow meticulously outlines each letter, creating a radiant effect that suggests the title itself is pulsating with light. This is further enhanced by a subtle, thin blue outer glow that helps the text distinctly stand out against the dark background. The title sits entirely beneath all other visual elements, distinctly grounded, with its glowing presence subtly illuminating the very bottom edge of Brosnan's pants where they almost meet the letters.

The key iconic visual symbol that powerfully defines this poster and immediately conveys its genre is the colossal, screaming, ethereal female face with intensely glowing white eyes, which dominates the upper central portion of the image. This spectral visage, emerging from the swirling blue mist, serves as the unequivocal embodiment of the supernatural threat and horror elements of the film. Its dramatically open, anguished mouth and piercing, luminous gaze instantly communicate the otherworldly menace and profound emotional intensity at the core of the narrative, functioning as the primary visual identifier for the ""nomads"" themselves."
968441,Música,/kUX5ourGUJDG0yvEeS3uooZS0dS.jpg,"The poster immediately draws the eye with its vibrant and inviting aesthetic, portraying two individuals connected by a whimsical, music-infused backdrop. The composition features a woman on the left and a man on the right, both framed in a medium close-up, gazing towards each other with gentle smiles and engaged expressions, suggesting a developing relationship or shared moment. The woman's head and upper torso are visible, her warm brown hair flowing, while the man's head and upper torso, including his distinctive curly hair and a patterned shirt, are also present. They are positioned to allow the central title to sit comfortably between them, acting as a visual bridge for their interaction.

The lighting throughout the poster is soft and diffused, creating a bright and even illumination across the subjects and the background. There are no harsh shadows, contributing to an overall gentle and optimistic quality. Subtle highlights catch the light on their skin and hair, enhancing their features without creating stark contrasts. The background itself appears to have a slightly textured, almost hand-drawn paper quality, with no strong directional shadows to suggest a specific light source within the scene.

A cheerful and lively color palette defines the poster. The dominant background hues are a warm, muted yellow-beige, providing a light and airy base, and a vibrant, almost kelly green that forms stylized cityscapes in the upper portion, suggesting buildings and an urban setting. Accent colors are generously distributed through various elements: a rich dark blue is used for the man's striped shirt, elements within the cityscape, and prominently for the central title text. Touches of bright orange appear in the woman's outfit (visible as a strip at the bottom of the frame) and as one of the abstract piano key elements. Scattered musical notes across the canvas are rendered in a playful assortment of green, blue, yellow, and orange, harmonizing with the main color scheme.

The emotional mood conveyed is distinctly joyful, romantic, and lighthearted. The protagonists' smiles and their focused gazes towards each other evoke a sense of warmth, connection, and perhaps budding affection. The lively musical notes and the bright, inviting colors collectively contribute to an atmosphere of optimism and playful charm, suggesting a story filled with positive energy and harmonious moments.

Centrally placed between the two subjects, slightly below their eye level, is the film's title, ""música."" It is rendered in a flowing, elegant script typeface, reminiscent of handwritten calligraphy, in a rich dark blue color. The title is large and prominent, commanding attention without overwhelming the characters. Playful musical notes emerge from and around the letters, seamlessly integrating the typography with the overarching theme of the poster and creating a dynamic interaction between the text and the surrounding visual elements.

The key iconic visual symbol that defines this poster is the pervasive presence of **musical notes** and the stylized **piano keys** at the bottom. These notes are scattered liberally across the entire background, drifting upwards from the ground level to float amongst the stylized city buildings, creating a sense of music permeating the environment. Below the title, three colorful, abstract shapes, resembling elongated piano keys—one blue, one green, and one orange—are depicted on slender stems, further emphasizing the musical theme and giving the impression that music is sprouting from the ground itself. These elements collectively underscore the film's musical core and its joyful spirit."
803796,KPop Demon Hunters,/zT7Lhw3BhJbMkRqm9Zlx2YGMsY0.jpg,"This vibrant movie poster presents a captivating visual narrative, skillfully layering different elements to convey a sense of action and intrigue. The composition is structured vertically, dominated in its upper two-thirds by a massive, glowing billboard that showcases three animated female K-Pop idol characters. The central idol is the largest and most forward, flanked by one with long pink hair on the left and another with short dark hair on the right, all depicted from the waist up in confident, poised stances. Below this prominent display, on what appears to be a stage or elevated platform, stand three different animated female characters, slightly smaller in scale but intensely dynamic. The central figure among them wears a sleek black suit with striking purple braided hair, holding a glowing sword and striking a powerful pose. To her left, another character with long flowing pink hair in a black suit lunges forward with two glowing swords, while on her right, a short-haired figure in a dark outfit readies a glowing sword and throwing stars. Beneath this stage, a shadowy crowd of monstrous, ambiguous figures gazes upwards, adding a touch of menace to the scene.

The lighting throughout the poster is characterized by its vivid, cool-toned luminescence. A strong light source seems to emanate from the large billboard, creating sharp highlights on the K-Pop idols and casting a glowing aura over the entire upper section. The demon hunters' weapons, brilliant with an intense blue light, serve as secondary light sources, illuminating their forms and the immediate surrounding stage area, creating crisp reflections and distinct but not overly dark shadows that often carry subtle blue and purple tints. The overall effect is bright and energetic, with the lower crowd bathed in deep shadows, making their forms indistinct and foreboding.

The color palette is dominated by an electric fusion of purples, blues, and pinks, lending a distinctly neon and futuristic aesthetic. Various shades of these colors are visible in the characters' hair, outfits, and the atmospheric glow, especially in the background cityscape which is rendered in muted cool tones. Yellow serves as a crucial accent, most notably on the central K-Pop idol's jacket, providing a warm contrast to the predominant cool spectrum. The glowing weapons introduce a stark, bright white-blue, while the demon hunters' outfits ground the vibrant hues with strong black tones.

An energetic and mysterious mood permeates the poster. The juxtaposition of glamorous K-Pop idols with fierce, weapon-wielding demon hunters creates an intriguing atmosphere of secret identities and high-stakes adventure. The dynamic poses of the lower characters convey a sense of immediate action and readiness for conflict, while the shadowy crowd below hints at a dangerous, unseen threat. The overall feeling is one of cool, modern excitement, tinged with an underlying sense of urban fantasy.

Typography is strategically placed to complement the visual hierarchy. At the very top of the billboard, ""HUNTRX WORLD TOUR"" is displayed in a clean, angular, light blue sans-serif font, clearly legible against the darker purple background and positioned above the idol figures. The main title, ""KPOP DEMON HUNTERS,"" anchors the bottom of the poster, spanning its full width. ""KPOP"" is presented in a large, bold, white sans-serif font with a subtle blue outline, featuring a distinctive star or diamond symbol integrated into the ""O"" and the ""P"". Directly below, ""DEMON HUNTERS"" uses a similar but slightly smaller bold white font, also with blue accents and the same star/diamond symbol within the ""O"" of ""DEMON"". This text sits on a dark platform, entirely below all character elements, ensuring maximum readability without any obstruction.

The key iconic visual symbol that singularly defines this poster is the **striking juxtaposition of the glamorous K-Pop idol billboard with the battle-ready demon hunters on the stage below**. This duality encapsulates the core premise of the film, presenting both the ""KPOP"" and ""DEMON HUNTERS"" aspects in a powerful, contrasting yet harmonious visual statement."
