id,title,poster_path,poster_caption
238,The Godfather,/3bhkrj58Vtu7enYsRolD1fZdja1.jpg,"The movie poster presents a strikingly dramatic and iconic composition, dominated by the solemn figure of a man against an abyss of deep black. The man, depicted from his head down to his waist, occupies the central upper portion of the frame, his gaze directed slightly to his right, conveying a profound and serious demeanor. He wears a classic black tuxedo, featuring a crisp white shirt and a black bow tie, with a solitary, vibrant red rose pinned elegantly to his lapel, providing the sole burst of color against the monochrome attire. His hands are clasped gently in front of him, cradling a richly textured, mottled reddish-brown cat, whose form rests just below his chest, adding an unexpected softness to the formidable presence.

The lighting is intensely chiaroscuro, emanating from the viewer's upper left, raking across the man's face and defining his features with stark contrasts. This illumination casts deep, expressive shadows across the right side of his face, plunging his left eye into near darkness while highlighting his prominent brow, nose, and cheekbone. The stark highlights on his slicked-back hair, shirt, and the cat's fur further enhance the dramatic relief, emphasizing texture and form against the profound blackness of the surrounding space. The overall color palette is overwhelmingly dominated by this absolute black, which consumes the entire background and a significant portion of the man's attire. Flesh tones are rendered with a painterly realism, incorporating deep oranges and browns in the shadowed areas, while the white of the shirt provides a luminous counterpoint. The rich reddish-brown of the cat offers warmth, but it is the single, vivid crimson of the rose that acts as the most potent accent color, drawing the eye with its stark beauty.

The emotional mood conveyed is one of immense gravitas, power, and a subtle undercurrent of quiet authority. The man's unsmiling, contemplative expression imbues the poster with a sense of weighty importance and an almost mythical presence, while the unexpected embrace of the cat introduces a layer of complexity—perhaps suggesting a hidden vulnerability, a paternal tenderness, or even a calculated duality within a figure of such strength. The atmosphere is one of dark sophistication and timeless elegance, hinting at profound narratives and formidable influence.

The movie title, ""The Godfather,"" is prominently displayed in the lower central part of the poster, positioned directly beneath the man's cradling hands and the cat. The word ""The"" is smaller and stacked above the much larger ""Godfather,"" which is rendered in a distinctive, robust, and slightly extended white serif typeface that evokes a sense of monumental authority. Intriguingly, the capital ""G"" in ""Godfather"" is ingeniously stylized to incorporate a silhouette of a hand pulling puppet strings, a powerful symbolic integration that speaks directly to the film's themes of control and manipulation. The white typography stands out crisply against the black canvas, serving to anchor the composition without overlapping or obscuring the central figures, allowing the visual hierarchy to remain clear and impactful.

The key iconic visual symbol that powerfully defines this poster and is instantly recognizable is the **stylized hand pulling puppet strings integrated within the ""G"" of the ""Godfather"" title**. This ingenious typographic element encapsulates the central themes of the film—control, power, and unseen influence—in a concise and visually striking manner, making it an indelible mark of the movie's identity."
1246049,Dracula,/libhghrUSBSEdHgF9uP1SQES0nQ.jpg,"The movie poster presents a deeply atmospheric and ominous scene, dominated by a stark blue-grey monochromatic palette. At its very center, a lone, enigmatic figure stands facing slightly away from the viewer, its form rendered almost entirely in silhouette. This central character, adorned in a dramatic, full-length cape and a tall top hat, holds a small, indistinct object in its clasped hands. Its lower half is subtly integrated with the foreground landscape and partially obscured by the prominent title.

The landscape itself is bleak and foreboding. The immediate foreground depicts a desolate, rain-soaked field of sparse, dry grass, serving as a solemn cemetery dotted with numerous simple, cross-shaped grave markers extending into the midground on both sides of the central figure. Beyond this mournful expanse, rugged, snow-capped mountains with sharp, jagged peaks rise on the left, fading into the heavy, overcast sky. On the far right, a towering gothic castle, complete with multiple spires and battlements, stands partially shrouded in the relentless downpour, mirroring the imposing mountains in its grandeur and dark presence. The entire scene is drenched in continuous, heavy rain, visible as streaks across the composition, creating a hazy, diffused effect.

The lighting is exceptionally dim and ambient, suggesting either deep twilight or an intensely stormy day. There is no discernible direct light source; instead, illumination appears to be highly diffused and absorbed by the thick rain. The central figure is almost a complete shadow, indicating minimal frontal lighting, contributing significantly to its mysterious and menacing aura. Similarly, the mountains and castle are cast in deep shadow, emphasizing their formidable and ancient nature. The overall effect of the lighting is one of pervasive gloom and chill.

The color palette is overwhelmingly cool and desaturated, built around various shades of blue-grey. This dominant hue saturates the sky, the heavy rain, the distant mountains, and the cemetery ground, imbuing the entire poster with a cold, melancholic, and somber tone. The primary accent color is the brilliant white of the movie title. A subtle, yet vital, secondary accent is the vibrant crimson red that drips from the lower tips of the 'r' and 'a' in the title, starkly contrasting with the monochrome background. A faint trace of deep purple can also be discerned along the inner lining of the central figure's cape.

The emotional mood conveyed is one of profound gothic horror, isolation, and pervasive dread. The heavy rain, the desolate cemetery, and the silhouetted figure standing stoically against the backdrop of an imposing castle and mountains evoke a powerful sense of an ancient, chilling evil. It feels like a scene steeped in tragedy and supernatural menace, creating an atmosphere that is both captivating and deeply unsettling.

The typography for the title, ""Dracula,"" is positioned centrally at the very bottom of the poster. It employs a distinctive, stylized gothic serif font, characterized by its sharp, angular serifs and robust letterforms, which lend it an antiquated and powerful presence. The letters are bold and rendered in bright white, ensuring they stand out prominently against the dark, rain-swept landscape. Crucially, small, vivid red droplets resembling blood drip from the lower points of the 'r' and 'a' in ""Dracula,"" making a direct and striking connection to the vampire theme. The text itself appears to rest on the ground, slightly overlapping the dry grass and the very bottom of the central figure's cape.

The key iconic visual symbol that defines this poster is the lone, cloaked, and top-hatted silhouette standing in the rain-swept cemetery. This figure, almost entirely in shadow and facing the vast, foreboding landscape, instantly encapsulates the essence of the classic vampire, representing mystery, power, and an inescapable, ancient presence, setting the stage for a tale of gothic horror."
1062722,Frankenstein,/g4JtvGlQO7DByTI6frUobqvSL3R.jpg,"The poster unfolds as a richly detailed, darkly atmospheric tableau, drawing the viewer into a world of Gothic ambition and tragic consequence. At its core, the composition is dominated by a grand, almost theatrical archway, elaborately adorned with dark, swirling rococo-esque ornamentation that frames the central narrative. Within this ornate boundary, the main figures are dramatically arranged against a starkly divided backdrop. To the left, a man with long, dark, curly hair and a pale, possibly blood-stained shirt, resembling Victor Frankenstein, looks intensely to his left, his profile sharp against a stormy sky punctuated by a vivid lightning strike illuminating a distant, craggy tower. Below him and slightly to the right, an older gentleman in a formal top hat and teal waistcoat gazes directly forward, appearing grounded and perhaps troubled. Complementing this, to the right of the old man, a woman with striking red hair and teal accents, adorned in an elegant blue off-the-shoulder gown, holds a human skull in her hands, her gaze fixed upwards with a pensive or fearful expression. Looming large behind this group, partially obscured by the dark framing, is the formidable, fur-clad figure of the Creature, its scarred and pale face emerging from the shadows, eyes fixed towards the right, mirroring the split in the background, which on its side features an icy, desolate seascape with a sailing ship battling harsh conditions.

The lighting throughout the poster is intensely dramatic and chiaroscuro, masterfully carving out forms from the pervasive darkness. Figures are illuminated with strong, directional light that accentuates contours and expressions. Victor Frankenstein's face is sharply lit from the left, casting deep shadows on his right side and emphasizing the intensity of his gaze, while the stormy background is intermittently flashed by brilliant white lightning. The Creature, though partially shrouded, reveals a harsh, greenish-tinged pallor on its face, receiving light from the right, highlighting its gaunt features and deep-set eyes. The woman and the older gentleman are bathed in a softer, more direct light that nonetheless creates depth and definition. At the bottom of the poster, the scene shifts to an interior, perhaps a laboratory, where two tall, cylindrical apparatuses glow with an eerie, vibrant electric green light, their luminescence casting a ghostly pallor on the surrounding darkness. To the far left, a multi-branched candelabra emits a warm, flickering orange glow, providing a stark contrast to the cooler, scientific light.

The overall color palette is a masterful blend of deep, somber tones with striking, deliberate accents. Dominant hues are rich browns, velvety blacks, and various shades of muted grey, particularly in the ornate frame and the Creature’s heavy fur. These deep tones are broken by vibrant splashes: the shocking electric green from the laboratory equipment, the vibrant blue of the woman's dress and her distinctive teal hair ornaments, and the complementary teal of the older gentleman's cravat. The stormy background introduces cool blues and whites of lightning, while the icy seascape on the right features cold blues and greens. Warm accents arrive in the form of the woman's reddish-brown hair and the gentle, golden glow of the candles, creating a delicate balance against the prevailing darkness.

The emotional mood and atmosphere are overwhelmingly one of dark foreboding, tragic ambition, and a haunting sense of the uncanny. The characters' expressions, particularly Victor's intense focus and the woman's pensive gaze at the skull, convey a deep psychological weight. The contrasting stormy and icy landscapes evoke themes of isolation, struggle, and the formidable power of nature against human endeavor. The lurking presence of the Creature, combined with the glowing scientific instruments, infuses the scene with a palpable sense of danger, unnatural creation, and the dreadful consequences of forbidden knowledge, creating a profoundly Gothic and unsettling feel.

The typography for the title, ""Frankenstein,"" is elegantly placed at the very bottom of the poster, resting on a plain, dark panel below all the illustrative elements. It is rendered in a beautiful, flowing, almost calligraphic script with a textured, slightly distressed appearance, suggesting an old manuscript or a classic tale. The letters are a stark, luminous white, providing a clear, commanding presence against the dark background. The initial ""F"" is particularly elaborate, with a graceful, extended swirl that adds to the antique, sophisticated aesthetic of the title, anchoring the entire composition with its elegant yet strong declaration.

The most iconic visual symbol defining this poster is undoubtedly the spectral, imposing presence of the Creature positioned directly behind Victor Frankenstein. This stark juxtaposition powerfully embodies the central conflict and the inseparable, haunting relationship between the creator and his monstrous creation, symbolizing the inevitable shadow of consequences that follows unchecked ambition."
11393,The Natural,/fwn1gYeOkS1XHKVFdNorKSIpix8.jpg,"This striking movie poster immediately captures attention with its dramatic yet wistful composition, dominated by a formidable, almost ethereal presence. In the upper two-thirds of the frame, the large, spectral image of a man, notably Robert Redford, emerges from a dark, swirling background of mist or storm clouds. He is depicted in a fedora-style hat, a collared shirt, a light-colored tie with a distinctive soft pink hue, and a dark jacket, looking directly forward with a serious, contemplative expression. This oversized figure acts as a colossal backdrop or an overarching memory, its shoulders extending widely across the poster.

Directly beneath this looming figure, at the central horizon of the image, a much smaller, intimate scene unfolds. A man and a woman stand close, holding hands and gazing into each other's eyes on a dark, verdant grassy field that occupies the lower fifth of the poster. The man wears a cap and a light-toned sweater, while the woman is in a flowing, light dress. They appear to be in a gentle glow, perhaps emanating from themselves, contrasting subtly with the more somber tones surrounding them. This grassy expanse forms a clear demarcation line, separating the iconic imagery above from the textual elements below.

The lighting throughout the poster is soft and diffused, creating an almost painterly quality. The large figure of Redford is illuminated from the front, with gentle highlights on his face and the brim of his hat, enhancing his somewhat ghostly or dreamlike appearance. Shadows are subtle, delineating form without harshness, contributing to the overall misty atmosphere. A faint, almost angelic glow surrounds the small couple, especially between them, suggesting a moment of pure, radiant connection against the darker landscape and the vast, overcast sky.

The color palette is predominantly cool and muted, steeped in deep blues, slate greys, and hazy purples that make up the turbulent, cloud-filled background. These dominant dark tones are accented by the natural, warm skin tones of Redford’s face, the subtle pink of his tie, and the pale, muted earth tones of the couple's clothing. The dark, rich green of the foreground grass grounds the composition, providing a stark contrast to the luminous elements and the title text.

An emotional mood of epic romance, deep nostalgia, and a touch of the mystical pervades the poster. The juxtaposition of the grand, almost mythical presence of the large figure with the tender, intimate scene of the couple evokes a sense of enduring love, destiny, or a powerful memory that transcends time. The dramatic lighting and swirling clouds add an air of profound significance and wonder, hinting at a story of heroism and heartfelt emotion.

At the very bottom of the poster, centered beneath the grassy field, the movie title ""The Natural"" is elegantly displayed. The word ""The"" is rendered in a refined, flowing script font, colored a soft, light cream, positioned directly above the larger, more prominent ""NATURAL."" This main title is presented in a strong, stately serif font with an almost beveled, metallic gold-brown appearance, giving it significant weight and classic appeal. The typography is clean and legible, providing a solid anchor to the composition without detracting from the evocative imagery above.

The single, most iconic visual symbol that powerfully defines this poster is the colossal, hat-wearing, spectral figure of Robert Redford emerging from the stormy backdrop. This dominant image immediately conveys the larger-than-life legend and enduring presence of the character, a powerful and almost mythic force overseeing the more intimate narrative below."
1198994,Send Help,/kL4MgAIZIYX3sCeG34N0XfVhCtt.jpg,"This movie poster immediately conveys a raw sense of terror and desperation, dominated by an intense, visceral red hue that permeates the background. At the heart of the composition, a disheveled woman, covered in grime and dirt, stands in a wide, slightly crouched stance, her body angled dynamically. Her head is thrown back, mouth wide open in a primal scream, eyes squeezed shut, conveying extreme distress. She clutches a sharp, short knife in her left hand, pointed downwards, while her right hand is open and splayed, reaching out in an urgent gesture. Her clothing, a button-up shirt and dark pants, appears stained and weathered, reflecting her perilous state.

Looming dramatically in the upper portion of the frame, behind the screaming woman, is a massive, spectral face, primarily defined by its haunting, wide-open eyes. These eyes are bloodshot and carry a palpable sense of pain, with a dark, tear-like streak visible beneath the left eye, indicating deep suffering. This colossal visage is rendered in the same dominant red as the background, appearing almost as a deeply shadowed or silhouetted element within the vibrant crimson field. Framing the central figure on either side, dark silhouettes of palm trees rise from the bottom, subtly suggesting a tropical or isolated setting under duress.

The lighting throughout the poster is stark and dramatic, with a strong, low-angle light source illuminating the central woman from the front, casting harsh highlights on her grim-covered skin and clothes, and deepening the shadows around her features. This dramatic illumination accentuates her anguish and the texture of the dirt covering her. The background, steeped in a deep, saturated, almost blood-red, creates an oppressive and menacing atmosphere. This vibrant red is the predominant color, accented by the earthy, muted tones of the woman's dirty attire and the stark black of the palm tree silhouettes and the poster's bottom strip. The knife she holds catches a glint of pale, metallic silver, a sharp contrast against the darker elements.

The overall emotional mood is one of overwhelming fear, desperation, and urgent peril. The screaming figure, the haunting eyes, and the blood-red palette combine to create an intensely visceral and anxiety-inducing atmosphere, strongly hinting at a horror or survival thriller narrative. At the very bottom of the poster, cleanly separated by a solid black band, the title ""SEND HELP"" is displayed. The typography is a bold, all-caps sans-serif font, rendered in a textured, slightly gritty yellow-gold color that stands out sharply against the black background. Positioned centrally, this direct plea serves as a potent summation of the visual narrative unfolding above it. The key iconic visual symbol that defines this poster is the overwhelming, blood-red background featuring the giant, distressed eyes looming behind the screaming woman, a powerful combination that immediately communicates terror and a desperate struggle for survival."
14938,The Alibi,/7PaZLT7vfCIU6p3nG0QkIvdrTpF.jpg,"The movie poster unfolds on a vast, pristine white background, establishing a clean and minimalist canvas that accentuates its few yet impactful elements. Positioned prominently in the upper central portion of this expansive white space are a pair of full, shapely lips, rendered in a warm, inviting red or coral hue, seemingly closed but notably bisected by a golden metallic zipper. This zipper runs horizontally across the center of the lips, its teeth firmly interlocked, with the pull tab situated towards the right, creating a powerful visual metaphor of enforced silence or a hidden truth.

The lighting on the lips appears soft and diffused, likely originating from a slightly frontal direction, which gently highlights the natural contours and subtle texture of the skin while casting faint, soft shadows that contribute to their three-dimensional quality. The metallic zipper gleams, reflecting the light with a distinct sheen that emphasizes its material and adds a touch of sharp realism to the otherwise organic form of the mouth.

Below this arresting image, the film's title, ""the ALIBI,"" is presented in two distinct parts. The word ""the"" appears in a smaller, lighter sans-serif font, positioned just above and slightly to the left of the prominent ""ALIBI."" The main title, ""ALIBI,"" is rendered in a significantly larger, bolder, and more substantial block sans-serif typeface, boasting a warm, earthy brown or golden color that harmonizes with the metallic tones of the zipper. This text is precisely centered beneath the zippered lips, drawing a direct visual connection between the symbol of silence and the movie's thematic core.

Along the very bottom edge of the poster, a horizontal strip features a sequence of closely cropped headshots of various characters, approximately eleven in total. These individual portraits are arranged in a continuous line, each face gazing forward with varied but generally serious or contemplative expressions, suggesting a diverse cast connected by the unfolding narrative. The lighting on these faces is consistent, appearing as controlled studio illumination that highlights individual features without harsh shadows, maintaining a subdued yet clear portrayal of each actor. The color palette of the poster is overwhelmingly dominated by the brilliant white background, which makes the vibrant red of the lips and the rich brown-gold of the typography stand out as strong accent colors. The faces at the bottom introduce a range of natural skin tones and hair colors, subtly enriching the overall visual without detracting from the central focus.

The emotional mood conveyed by the poster is one of intrigue and mystery, underscored by a palpable sense of secrecy or undisclosed information. The zippered mouth immediately suggests themes of hidden truths, silence, or perhaps a forced inability to speak, creating a suspenseful and thought-provoking atmosphere. The combined effect of the striking central image, the evocative title, and the array of character faces implies a complex narrative involving these individuals and a central secret.

The most iconic visual symbol that unequivocally defines this movie poster is the pair of human lips with a fully zipped, golden metallic zipper running across them. This powerful and unusual juxtaposition instantly communicates the essence of secrecy, silence, or the inability to reveal an important truth, acting as a singular, memorable emblem for the film's narrative."
