id,title,poster_path,poster_caption
1236153,Mercy,/pyok1kZJCfyuFapYXzHcy7BLlQa.jpg,"This movie poster immediately draws the eye with its dynamic, multi-layered composition, presenting a futuristic action-thriller aesthetic. In the foreground, positioned in the lower half and slightly to the left of center, a determined-looking man, presumably Chris Pratt, strides forward with a focused gaze directed towards the viewer's right. He is clad in a white long-sleeved shirt overlaid with a dark tactical vest, holding a shotgun across his body. Beneath him, sweeping lines suggest rapid motion across a reflective surface. Behind him, the midground explodes with a chaotic cityscape rendered in warm, fiery tones, featuring tall buildings engulfed in orange and yellow explosions, alongside distant small helicopters or drones hovering in the smoke-filled sky. To the far left, a police officer on a sleek, futuristic flying motorcycle-like vehicle hovers, adding to the advanced, action-packed setting.

Dominating the upper two-thirds of the poster, a large, ethereal female face gazes directly forward with an intense, piercing look. Her features are rendered with a soft, almost glowing light, making her appear semi-transparent and integrated with subtle digital patterns that stream down around her, suggesting a holographic or virtual presence. This central figure is the focal point of the background, appearing to oversee or preside over the action below. A police car is dimly visible in the far background on the right, further establishing the urban conflict.

The lighting throughout the poster is dramatic and varied. The foreground figure of the man is lit from the front-right, creating subtle shadows that define his features and the folds of his clothing, giving him a grounded, realistic presence. In stark contrast, the colossal female face in the background glows with an internal or diffuse light, casting no hard shadows and reinforcing her otherworldly, commanding presence. The cityscape behind the man is illuminated by the harsh, vibrant orange and yellow light of the explosions, which cast dynamic glows on the surrounding structures and create a strong sense of urgency and danger. The sky above is bright, almost blown out, especially around the female figure, contributing to her ethereal quality.

The overall color palette is a compelling blend of cool and warm tones. The upper section, featuring the female figure and the sky, is dominated by a cool, desaturated blue-grey and white, imbued with subtle digital patterns. This cool backdrop contrasts sharply with the vibrant, fiery oranges and yellows of the explosions in the midground cityscape, which introduce a dramatic warmth. The man in the foreground is dressed in a crisp white shirt and a dark blue tactical vest, providing grounded color anchors. The title ""MERCY"" stands out in a bold, striking red-orange, with the final 'Y' accented in a brighter yellow-orange, serving as a powerful visual highlight.

The emotional mood and atmosphere are intensely suspenseful and action-oriented, conveying a sense of high-stakes conflict within a technologically advanced, perhaps dystopian, urban environment. The man's focused expression and ready stance evoke determination and urgency, while the explosions and flying vehicles underscore imminent danger and chaos. The dominant female figure, with her powerful, direct gaze, adds a layer of mystery, control, or perhaps even judgment, suggesting a deeper, perhaps non-physical, antagonist or governing force. There is a palpable tension between the immediate, physical threat and the overarching, enigmatic presence.

The typography for the film title ""MERCY"" is bold, sans-serif, and uppercase, positioned prominently across the central horizontal band of the poster. It is rendered in a vibrant red-orange, with the 'Y' subtly highlighted in a brighter yellow-orange, giving it a dynamic visual pop. The letters are large enough to be immediately impactful but carefully placed to interact with the subjects without obscuring them. The left edge of the 'M' slightly overlaps the flying police vehicle, while the rest of the title sits in front of the female figure's lower head and the upper parts of the city buildings. To the immediate left of the ""M,"" integrated almost as part of its design, is a striking circular icon resembling a countdown timer or radar, with a red outline and the number ""9-"" visible, further emphasizing the theme of urgency or emergency.

The key iconic visual symbol that defines this poster is undoubtedly the **imposing, ethereal female face** dominating the upper canvas. Her semi-transparent, digitally infused appearance, combined with her commanding, direct gaze, immediately establishes a central theme of surveillance, control, or a powerful, perhaps artificial, intelligence at the heart of the narrative. She is not merely a background element but an enigmatic, powerful entity that visually anchors the poster and sets the tone for a futuristic thriller with profound implications."
1290821,Shelter,/buPFnHZ3xQy6vZEHxbHgL1Pc6CR.jpg,"The movie poster presents a dynamic and urgent scene, dominated by two figures in hurried motion across a desolate, windswept shoreline. In the immediate foreground and occupying the central-left portion of the frame is a rugged man, clad in a heavy, fur-lined parka and a knit beanie, his face partially turned towards the viewer with a grave expression. A rifle is slung across his chest, held by his right hand, emphasizing his readiness or defensive posture. Trailing slightly behind and to his right, a younger girl, also bundled in warm clothing, runs with a look of wide-eyed apprehension, her gaze seemingly fixed on something beyond the frame. Both figures are mid-stride, propelling themselves forward and subtly to the left, creating a strong sense of relentless movement and escape. The background reveals a rugged sandy beach on the lower left, meeting a choppy, dark sea, while the upper two-thirds of the poster are filled with a stormy, overcast sky, through which a brilliant, low sun or intense light source peeks from the upper right quadrant.

The lighting dramatically sculpts the subjects, with the intense, bright light source in the upper right casting a strong backlight, especially on the figures' right sides. This creates a striking rim-light effect that highlights their outlines against the darker, textured environment, particularly noticeable on the man's fur hood and the girl's windswept hair. Shadows are soft but defined, extending forward from the figures, emphasizing their forward momentum. The overall illumination, while bright in areas, retains a muted, almost desaturated quality that contributes to the somber atmosphere.

The color palette is predominantly earthy and muted, reflecting the harsh environment. Dominant tones include the deep military greens and browns of the man's clothing, the subtle reddish-brown of the girl's attire, and the natural beige and grey hues of the sandy beach. The sky shifts from a dark, brooding blue-grey at the top to a lighter, more yellowish-grey around the bright light source, while the sea is rendered in cool, dark blue-green tones. This naturalistic, somewhat desaturated palette is sharply contrasted by the single, vibrant accent color of the title: a striking, almost neon, lime-green with a distressed, gritty texture that stands out vividly against the subdued background.

The emotional mood conveyed is one of urgent flight and desperate survival. The running postures of both figures, combined with their somber and worried expressions, suggest a relentless journey or escape from an unseen threat. The man's armed presence and his protective positioning in front of the girl evoke themes of guardianship and vulnerability in a bleak, unforgiving world. The vast, open, yet stormy landscape enhances this feeling of isolation and struggle, while the sliver of strong light hints at a potential destination or a flicker of hope amidst the harshness.

The typography for the movie title, ""SHELTER,"" is bold and commanding. It is presented in a large, sans-serif font, colored in the aforementioned vibrant, distressed lime-green. The text is positioned prominently across the lower center of the poster, overlapping the lower half of the man's body and extending onto the sandy beach. The letters are substantial enough to interact with the figures, with the 'L' and 'T' of ""SHELTER"" notably obscuring parts of the man's left leg, anchoring the title firmly within the scene and integrating it as an integral part of the visual narrative rather than a simple overlay.

The most defining iconic visual symbol of this poster is the resolute, armed man leading and protecting the vulnerable, running child. This powerful pairing immediately communicates themes of survival, guardianship, and flight through a dangerous world, with the rifle underscoring the constant threat or the necessity of defense in their desperate journey for safety."
1272837,28 Years Later: The Bone Temple,/kK1BGkG3KAvWB0WMV1DfOx9yTMZ.jpg,"The poster unfolds a profoundly unsettling and apocalyptic vision, centered on a gaunt, screaming figure set against a towering, infernal landscape. Positioned in the lower-middle, the central subject is a pale-skinned, emaciated individual, shirtless save for dark, flowing trousers that extend wide to the sides. With head thrown back and mouth agape in a visceral cry, arms outstretched and fists clenched, the figure conveys immense pain or rage, its stark white skin contrasting sharply with dark smudges or markings across its body. Behind this tormented character, a menacing forest of countless, narrow, towering pillars, seemingly crafted from bones or ancient, twisted wood, recedes into the murky distance, creating an oppressive sense of scale and entrapment. A vibrant, destructive line of fire blazes horizontally across the ground directly behind the figure and at the base of these pillars, serving as the primary light source for the scene. Above, the sky is a turbulent expanse of dark, heavy smoke clouds and a sparse smattering of distant stars, transitioning from a deep, ominous greenish-black at the top to a fiery, smoke-choked orange and red closer to the horizon.

A strong, low-angle light emanates almost entirely from the furious ground fire, casting an intensely dramatic upward glow across the entire scene. This infernal illumination bathes the screaming figure from below, highlighting its skeletal features and throwing the underside of its arms into bright relief while its upper body casts subtle, dramatic shadows. The countless pillars are vividly lit along their lower and mid sections, their intricate textures illuminated by the fiery glow, while their tops dissolve into the encroaching darkness and smoke. The immediate foreground, beneath the figure, remains in deep shadow, almost black, further emphasizing the dramatic upward lighting and the glowing midground.

The overall color palette is strikingly warm and oppressive, dominated by deep, fiery reds, burnt oranges, and rich sienna browns that permeate the pillars, the atmosphere, and the light from the flames. These dominant hues are starkly punctuated by the brilliant, almost molten yellow and orange of the ground fire, serving as a powerful accent color. Above, the sky introduces cooler, darker tones of deep greenish-black and charcoal, providing a somber contrast to the fiery lower half of the poster.

The emotional mood conveyed is one of profound horror, desolation, and visceral despair. The screaming figure's agony, combined with the infernal landscape and towering bone-like structures, evokes a sense of apocalyptic dread and a world consumed by an unspeakable terror. The intense, dramatic lighting and the pervasive fiery colors amplify this feeling of an overwhelming, inescapable nightmare.

Typography for the film's title is prominently displayed in the upper third of the poster, integrated within a large, distressed red biohazard symbol outlined in black. ""28 YEARS LATER"" is stacked in two lines, rendered in a gritty, somewhat condensed sans-serif font, colored white, and positioned centrally within the upper curve of the biohazard symbol. Directly beneath this, also in white and stacked in two lines, is ""THE BONE TEMPLE,"" presented in a larger, bolder, distressed sans-serif typeface, occupying the central and lower portions of the symbol. The stark white text stands out powerfully against the deep red of the symbol and the dark, tumultuous sky behind it, clearly establishing the movie's identity without obscuring the background.

The defining key iconic visual symbol that powerfully encapsulates the essence of this poster is the distressed red biohazard symbol, centrally positioned in the upper portion, encompassing the entire movie title. This symbol immediately communicates themes of contagion, danger, and a post-apocalyptic world, directly linking to the ""28 Years Later"" franchise and setting a tone of imminent threat and profound horror."
1419406,The Shadow's Edge,/e0RU6KpdnrqFxDKlI3NOqN8nHL6.jpg,"This movie poster immediately immerses the viewer in a high-stakes, action-packed world, defined by a dynamic, low-angle perspective looking up at a large ensemble of intense characters. The subjects are dramatically positioned around and against a prominent, angular metallic structure, which strongly resembles a futuristic train or subway car, splitting the composition with its converging lines that draw the eye upwards into a shadowy, industrial environment. On the left, a central male figure, clad in a black leather jacket and blue jeans, holds a pistol ready, leaning against the structure with a grim, focused expression, while a younger companion in denim crouches below, equally alert. Behind them, other figures emerge from the shadows, suggesting a team. On the right, an older, distinguished male figure in a long dark coat and glasses stands upright, a watchful gaze on his face, while a younger, armed man in a dark jacket crouches in the foreground, aiming his pistol. Further back, a cohort of men in suits, also armed, stands ready, implying a larger conflict.

The lighting is intensely dramatic and artificial, creating sharp contrasts and deep, enveloping shadows that contribute to the mystery and tension of the scene. Light sources, possibly overhead, cast strong highlights on the characters' faces, their leather attire, and the metallic surfaces of their firearms, while plunging the background and areas behind the figures into gloom. Small, stark red lights embedded along the central structure pierce the darkness, serving as crucial points of accent lighting against the predominantly dark palette and hinting at warning or danger. A subtle digital ""glitch"" or static effect is artfully integrated across the image, particularly in the darker regions and along edges, reinforcing a modern, possibly technological thriller aesthetic.

The overall color palette is strikingly dark and desaturated, dominated by a spectrum of deep grays, charcoals, and blacks, which underscore the shadowy and serious atmosphere. Muted blues are visible in the characters' denim clothing and in some of the metallic components of the environment, providing cool undertones. The vivid red from the small indicator lights stands out as the primary accent color, providing a critical visual pop that draws attention and signifies urgency against the otherwise monochromatic scene.

The emotional mood conveyed is one of extreme tension, urgency, and imminent confrontation. The grim, focused expressions of the characters, coupled with their armed and ready poses, evoke a sense of high stakes and danger. The dark, gritty industrial setting, combined with the subtle digital distortion, creates a potent atmosphere of a contemporary or near-future thriller, where surveillance and conflict are paramount.

The movie's title, ""THE SHADOW'S EDGE,"" is prominently displayed in a clean, all-caps sans-serif typeface at the very bottom of the poster. Rendered in a light gray or off-white, it stands out clearly against the dark background, anchoring the composition. The text is positioned below the feet of the closest figures, ensuring it does not overlap or obscure any of the subjects, and the subtle digital glitch effect extends around the typography, seamlessly integrating it into the poster's visual language.

The key iconic visual symbol that defines this poster is the **converging angular metallic structure**, likely a train car, that slices through the composition. Its dynamic lines and imposing presence not only provide a powerful backdrop and divide the characters but also symbolize the claustrophobic, high-speed, and dangerous environment in which the narrative unfolds, with the intermittent red lights serving as a constant visual cue of peril."
840464,Greenland 2: Migration,/z2tqCJLsw6uEJ8nJV8BsQXGa3dr.jpg,"This compelling movie poster presents a scene of intense human resilience against an apocalyptic backdrop, anchored by a prominent family unit. The composition centers on three figures arranged in a loose, upward-sloping diagonal from left to right, drawing the viewer's eye towards an unseen threat. In the immediate foreground, slightly right of center, stands a rugged man with a beard, his gaze fixed intently towards the left, conveying a deep sense of concern and vigilance. Just behind and to his left, a woman with long dark hair mirrors his focused expression, her face slightly turned towards the same direction, suggesting shared apprehension. Behind the man and slightly higher, a teenage boy looks up and to the right, his youthful face reflecting a similar gravity, completing the familial grouping. The figures occupy the lower half and mid-ground of the poster, their bodies cropped just below the waist, implying they are traversing a rugged landscape where tall, dry grasses are visible in the bottom right corner.

The lighting is soft and diffused, emanating from an implied source in the upper left, casting a gentle, yet dramatic glow on the subjects' faces and shoulders. This soft illumination highlights their weary but determined expressions, while subtle shadows sculpt their features and add depth to their heavy, practical clothing, suggesting an overcast sky or an atmosphere thick with smoke or dust. The overall effect is one of a harsh but not entirely dark environment, emphasizing a perpetual twilight or a world altered by disaster.

The color palette is predominantly muted and earthy, dominated by various shades of desaturated browns, olives, and greys found in the characters' jackets, scarves, and the hazy background landscape. The sky above is a brooding mix of muted blues and greens, hinting at a world under siege. These somber tones are powerfully contrasted by vivid streaks of warm orange and yellow that define the fiery meteors raining down across the upper left sky, serving as dramatic accent colors that signify immediate danger and cataclysm. The overall impression is one of a grim, survivalist world, punctuated by explosive, catastrophic events.

An overwhelming sense of urgency, desperation, and grim determination defines the emotional mood and atmosphere of the poster. The characters' focused, unsmiling expressions and their collective gaze into the distance convey a profound watchfulness and a deep concern for what lies ahead or what is falling from above. The ominous meteor shower in the background unmistakably sets an apocalyptic tone, creating an atmosphere of impending doom mixed with the stark reality of human endurance. It evokes a feeling of quiet resolve in the face of insurmountable odds.

The typography for the movie title, ""GREENLAND 2 MIGRATION,"" is boldly positioned across the bottom of the poster, overlapping the subjects' lower bodies and the foreground grass. ""GREENLAND"" is rendered in a chiseled, metallic silver sans-serif font, conveying strength and modernity. The number ""2"" stands out, larger and slightly separated, gleaming with a distinct golden-bronze sheen that gives it prominence and a sense of preciousness or continuation. Below ""GREENLAND,"" the subtitle ""MIGRATION"" is displayed in a smaller, wider-tracked metallic grey sans-serif font, providing narrative context. The metallic textures of the typography create a stark, almost industrial contrast to the organic and worn textures of the characters' attire and the natural environment.

The singular, most iconic visual symbol that defines this poster is the dramatic cascade of fiery meteors streaking across the upper left quadrant of the sky. These luminous, destructive projectiles with their trailing smoke and fire immediately communicate the central theme of a global catastrophe and serve as the paramount visual representation of the overwhelming threat the characters face, instantly establishing the film's genre and the stakes involved."
1084242,Zootopia 2,/oJ7g2CifqpStmoYQyaLQgEU32qO.jpg,"This vibrant and bustling movie poster captures a moment of dynamic, chaotic energy within a sprawling animal metropolis. The composition is angled upwards, creating a dramatic perspective that draws the eye from a close-up street scene in the foreground towards a distant, diverse cityscape under a brilliant blue sky. The central focus is a frantic rush of anthropomorphic animals, predominantly in the lower and middle sections, with a sense of urgency radiating from their expressions and poses.

The lighting is bright and clear, indicative of a sunny day, with the primary light source appearing to emanate from the upper-right, casting distinct, well-defined shadows that fall towards the lower-left, adding depth and volume to the characters and environment. This strong, yet soft, illumination enhances the vivid colors and intricate details across the scene.

The overall color palette is exceptionally rich and diverse, mirroring the varied inhabitants of Zootopia. Dominant colors include the brilliant blues of the sky and the glowing turquoise of the traffic light, contrasted with the lush greens of the prominent ""Zootopia"" street sign and various bits of foliage. Warm earthy tones of oranges, browns, and tans are prevalent in the fur and skin of many animals, such as the fox, rabbits, elephants, and bears, as well as in the facades of several buildings. Accent colors provide striking visual pops, including the bright pink of Nick Wilde's Hawaiian shirt with its green leaf patterns, Judy Hopps' dark blue police uniform, and the red and yellow elements found in the traffic light and some architectural details. The glowing blue snake and the red elements on the water slides in the background further diversify the palette.

The emotional mood conveyed is one of exhilarating, yet somewhat comical, panic and adventure. The wide-eyed, running expressions of the central characters, Nick and Judy, surrounded by a throng of other reacting animals – some fleeing, some observing with surprise – create an atmosphere of immediate, high-stakes action. Despite the evident alarm, the overall brightness, whimsical nature of the characters, and detailed, fantastical cityscape inject a sense of vibrant, fun chaos rather than genuine terror, suggesting an exciting journey or a thrilling chase sequence.

The typography for the title ""ZOOTOPIA"" is prominently displayed on a green rectangular street sign, positioned in the upper-right quadrant of the poster. The letters are bold, white, and sans-serif, with a subtle rounded or organic quality that integrates them seamlessly into the animated world. The sign itself is attached to a dark gray pole that dissects the upper-left corner of the image, further grounding the title within the urban environment. The title is clearly legible and intentionally placed as an integral piece of the city's infrastructure, distinct yet connected to the chaotic activity below.

The key iconic visual symbol that defines this poster is the illuminated pedestrian traffic light, prominently featuring a bright, glowing turquoise number ""2."" This specific element not only draws immediate attention with its distinctive color and digital display but also subtly communicates a significant contextual detail about the film it represents, making it a unique and defining visual cue for this particular poster."
