id,title,poster_path,poster_caption
862,Toy Story,/uXDfjJbdP4ijW5hWSBrPrlKpxab.jpg,"The vibrant movie poster for ""Toy Story"" presents a dynamic and playful scene against a clear, bright blue sky background, creating an immediate sense of adventure and boundless possibility. The composition is highly active, with the two main characters, Buzz Lightyear and Woody, positioned centrally and engaged in distinct motions. Buzz Lightyear dominates the upper right portion, depicted mid-flight with his wings fully extended, one arm raised in a powerful, heroic gesture, and a confident, smiling expression. Below and slightly to his left, Woody the cowboy is caught in a falling or mid-air swing, looking upwards towards Buzz with an enthusiastic and slightly surprised grin, his body twisted in motion.

Beneath these two flying figures, the other beloved toys are clustered together on what appears to be a checkered quilt or bedspread, angled upwards from the bottom left to the right, suggesting they are observing the aerial antics. This ground plane is anchored by a wooden bed frame or chair leg on the far left. Among the group are Bo Peep, standing demurely with her staff; a mischievous troll doll; Mr. Potato Head with a surprised expression; Slinky Dog stretching; and Rex the dinosaur, roaring with excitement. From the upper right, a green army man descends via parachute, contributing to the action-packed atmosphere, while more green army men are scattered across the quilt below.

The lighting throughout the poster is bright and direct, emanating from an unseen source high and to the left, which casts clear, defined shadows that give the characters and objects a strong three-dimensional presence and volume. Highlights gleam off Buzz Lightyear's helmet and glossy suit, as well as the plastic surfaces of the other toys, indicating a clean, almost idealized quality of light. The shadows under Woody's hat brim and along the folds of the quilt add depth and texture to the scene.

The overall color palette is dominated by a cheerful and energetic combination of primary and secondary hues. The vast expanse of brilliant blue sky provides a striking backdrop. Dominant colors include the vivid yellows of the ""TOY"" text, the bright green of Buzz Lightyear's suit and Rex, the deep reds of Woody's bandana and the ""STORY"" banner, and the earthy browns of Woody's hat and boots. Accent colors like the purples on Buzz's helmet and wings, the soft pink of Bo Peep's dress, and the orange of Mr. Potato Head's nose add further visual interest and contribute to the poster's warm and inviting aesthetic.

The emotional mood conveyed is one of sheer fun, excitement, and a sense of wonder. The characters' animated expressions and dynamic poses suggest an unfolding adventure, full of playful chaos and heroic feats. There's a palpable sense of camaraderie among the toys, even amidst their varied actions, creating an atmosphere that is both thrilling and heartwarming, perfectly encapsulating a children's animated adventure.

The typography for the movie title, ""TOY STORY,"" is prominently positioned in the upper left quadrant, assertively set against the expansive blue sky. ""TOY"" is rendered in large, bold, yellow letters with a thick blue outline, giving it a playful yet solid presence. Directly beneath it, ""STORY"" is inscribed in white letters upon a vibrant red, rectangular banner, also featuring a blue outline, with the banner slightly overlapping the bottom of the ""TOY"" lettering. This distinct logotype is positioned so that it clearly stands out without obstructing the main characters, effectively framing the dynamic action below.

The key iconic visual symbol that powerfully defines this poster is Buzz Lightyear in his full-body flying pose, with his iridescent wings fully extended, one fist raised, and a determined, heroic smile. This specific depiction of Buzz, soaring against the blue sky, encapsulates the spirit of adventure, the introduction of a new, fantastical toy, and the exciting, imaginative world that the film promises to explore."
4916,Guilty as Sin,/a5b53cYM23bUA7OyoNyDtIJ38kc.jpg,"This compelling movie poster is dominated by a dramatic interplay of figures and architecture, set against a stark backdrop that evokes both urban grandeur and peril. In the upper right quadrant, a serious-faced man, recognized as Don Johnson, gazes intently forward, his expression taut with unspoken tension. Below and slightly to his left, the equally intense face of a woman, Rebecca De Mornay, is angled, her piercing blue eyes directed outward and to the left, adding a layer of wary scrutiny to the composition. She is positioned slightly in front of and below the man, her form emerging from the shadowy right side of the frame.

The lighting throughout the poster is dramatic and directional, emanating from an implied source above and to the left, casting a soft yet purposeful glow on the actors' faces, highlighting their features and expressions. The man's cheekbones are subtly defined, while the woman's blonde hair catches the light, illuminating her profile. Deep, rich shadows envelop much of the right side of the poster, creating a stark contrast with the illuminated subjects and the brighter, more expansive left side. This contrast contributes to the overall sense of mystery and depth.

The color palette is deliberately somber and intense, primarily featuring deep blues and teals in the sky on the left, which gradually transition into dark, almost black, shadows on the right. A striking reddish-brown skyscraper, textured with a distinct grid pattern, commands the left side of the poster, stretching vertically from the bottom edge almost to the top. Below this formidable structure, a cluster of city buildings with warm, glowing lights punctuates the lower left corner, hinting at an urban landscape. The warm tones of the actors' skin and the luminous blue of the woman's eyes provide key accent colors, standing out against the cooler background.

The emotional mood conveyed is one of intense suspense and impending drama. The serious expressions of the main characters, coupled with the ominous backdrop, create an atmosphere pregnant with conflict and danger. High above the distant city and to the left of the towering skyscraper, a small, silhouetted figure is dramatically captured mid-fall against the blue sky, instantly signaling a critical event, perhaps a tragedy or a crime, and deepening the sense of unease and peril.

The title, ""GUILTY AS SIN,"" is rendered in a stately, ornate serif font, styled in a crisp white that sharply contrasts with the dark lower right portion of the poster. The word ""GUILTY"" is large and central at the bottom right, with ""AS SIN"" positioned slightly above and to its right, in a slightly smaller but equally distinctive font. This placement ensures the title is prominent and clearly legible, interacting by overlapping the lower edge of the woman's form and anchoring the dramatic narrative.

The singular, most iconic visual symbol that defines this poster is undoubtedly the **falling silhouetted figure** against the backdrop of the massive skyscraper and vast sky. This small but powerfully symbolic image immediately communicates the central theme of a high-stakes thriller, involving a dangerous fall, a crime, or a crucial event, acting as a potent visual hook that encapsulates the film's dark and dramatic essence."
13398,Tokyo Godfathers,/sPC66btzQlzuRdPKiSDYZ5Hvxgc.jpg,"The movie poster presents a captivating urban winter scene, featuring three distinct figures standing prominently in the foreground against a richly detailed city backdrop. From left to right, a tall, slender individual in a vibrant yellow coat and orange turban stands with an arm subtly raised, gesturing or observing, while a shorter central figure in a bright red coat holds a bundled baby tenderly. To the right, a broader, bearded man in a multi-toned blue and yellow jacket stands with hands in his pockets, gazing forward. This trio is arranged in a slight diagonal, with the central figure slightly advanced, creating a dynamic sense of their shared journey. Behind them, a bustling cityscape unfolds under a gentle snowfall, characterized by tall, modern buildings and a street lined with trees adorned with warm, glowing string lights. Dominating the distant skyline is the iconic, brightly illuminated Tokyo Tower, standing as a striking reddish-orange beacon.

The lighting throughout the poster is warm and somewhat diffuse, emanating from multiple urban sources rather than a single direct one. The city lights, particularly the festive string lights on the trees and the glow of the Tokyo Tower, cast a soft, inviting illumination, creating highlights on the buildings and the falling snow. The characters themselves are well-lit, with subtle shadows beneath their feet grounding them on the faintly textured, snowy ground, suggesting an ambient light source slightly in front and above them. This combination of foreground illumination and background glow imparts a sense of depth and atmosphere.

The overall color palette is a harmonious blend of warm and cool tones, anchored by earthy browns and complemented by vivid primary and secondary colors. The dominant hues include the vibrant mustard yellow of the left figure's coat, the rich red of the central figure's coat, and the striking teal-blue and yellow of the right figure's jacket. These strong character colors are set against the warm, almost fiery orange and red of the distant Tokyo Tower and the golden glow of the street lights. Cooler tones are provided by the darker blues and greys of the urban buildings and the crisp white of the falling snow and the baby's blanket. The ground beneath the characters is a subtle, desaturated green-beige, providing a neutral base.

An emotional mood of poignant hope and resilient camaraderie permeates the poster. The falling snow and the warm, festive lights evoke a sense of the holiday season, yet the worn attire of the characters suggests a challenging existence. The tender way the baby is held by the central figure, combined with the determined expressions of the trio, conveys a heartwarming narrative centered on care, unexpected family bonds, and a journey through a bustling, yet potentially cold, urban environment. There's an underlying sense of adventure and human connection despite their circumstances.

The movie title, ""Tokyo Godfathers,"" is prominently displayed across the bottom quarter of the poster. It is rendered in a classic, decorative serif typeface with a slightly rough or textured finish, lending it a timeless and dignified appearance. The letters are a light cream or off-white color, sharply defined by a thick, dark brown or maroon outline, making them highly legible against the lighter ground. The text is positioned entirely below the knees of all three characters, creating a clear visual foundation for the composition without overlapping or obscuring any part of the subjects.

The key iconic visual symbol that singularly defines this poster is the **Tokyo Tower**. Its distinctive, glowing red-orange silhouette in the background immediately identifies the setting as Tokyo, serving as a powerful and recognizable landmark that anchors the entire scene within a specific, vibrant metropolitan context."
1241470,Osiris,/3YtZHtXPNG5AleisgEatEfZOT2w.jpg,"The movie poster for ""OSIRIS"" immediately immerses the viewer in a world of intense danger and impending conflict, dominated by a fiery red and orange color palette. The composition is structured with a dynamic foreground leading to an ominous background, creating a strong sense of depth and urgency.

In the immediate foreground, positioned prominently on the left, a rugged man with a beard, appearing to be the central protagonist, is captured in a powerful stance, aiming a rifle with a prominent scope directly forward and slightly to the right. His body is angled, and his face, etched with determination, is partially illuminated by the ambient red glow. Behind him and slightly to his right, two women form a cohesive unit. The first woman, closer to the protagonist, holds a pistol equipped with a bright red laser sight, also aiming forward. Further back and to the right, the second woman firmly grips a rifle, holding it ready, her gaze intense. These three human figures are positioned in a diagonal line, suggesting movement or readiness as a united team, their forms partially silhouetted against the pervasive red light but with enough detail to convey their gear and expressions.

The lighting throughout the poster is dramatic and highly stylized. A powerful, infernal red glow emanates from the upper-center background, specifically from within a large, arch-shaped portal or doorway, casting the entire scene in a dangerous, almost hellish light. This intense backlighting creates a stark silhouette for the central iconic figure in the background. For the human subjects in the midground and foreground, the primary light seems to come from the general environment and an unseen source slightly to their front-right, illuminating their faces and the details of their weapons and tactical gear with a strong orange-red hue. Shadows are deep and pronounced, enhancing the rugged textures of their clothing and skin, contributing to a chiaroscuro effect that emphasizes tension. The overall quality of light is atmospheric and moody, suggesting an enclosed or smoke-filled environment.

The dominant color scheme is a highly saturated blend of deep reds, oranges, and shadowy blacks, creating a visceral and threatening atmosphere. The vibrant, almost molten red of the background portal bleeds into the entire image, saturating the skin tones and clothing of the characters, turning them into shades of fiery orange and dark crimson. Accent colors are sparse but effective; the bright yellow-orange glow of the laser sight and the subtle internal glow of the ""OSIRIS"" title provide key points of visual contrast against the otherwise monochromatic fiery tones.

Emotionally, the poster radiates a mood of high-stakes action, suspense, and impending confrontation. The determined, focused expressions of the armed characters, combined with the ominous, towering figure in the background, evoke a sense of grave danger and the need for immediate, decisive action. There's an underlying sense of being on the brink, preparing for a critical battle in a hostile, perhaps alien, environment.

The title ""OSIRIS"" is rendered in a clean, modern sans-serif font, horizontally centered at the very bottom of the poster. Its letters possess a luminous quality, glowing with a soft, bright yellow-orange light that gradually fades outwards, creating a subtle halo effect. This glowing typography stands out clearly against the deep, hazy red and black tones of the lower part of the image, appearing to emerge from the atmospheric fog without obstructing any of the character elements above.

The defining visual symbol of this poster is undoubtedly the imposing, heavily armed, and silhouetted figure standing squarely within the intensely glowing red archway in the far background. This powerful and mysterious entity, with its broad shoulders and discernible weaponry, serves as the ultimate focal point of threat and the driving force behind the narrative, instantly communicating the sci-fi or action-thriller genre and the formidable challenge awaiting the protagonists."
411,"The Chronicles of Narnia: The Lion, the Witch and the Wardrobe",/iREd0rNCjYdf5Ar0vfaW32yrkm.jpg,"The movie poster for ""The Chronicles of Narnia: The Lion, The Witch and The Wardrobe"" is a richly composed tableau, drawing the viewer into a world of epic fantasy. At the very center, dominating the mid-section, is the majestic, golden-maned face of a lion, its piercing emerald eyes gazing directly forward, embodying a sense of wisdom and power. Above this central figure, the film's title, ""THE CHRONICLES OF NARNIA,"" is emblazoned in large, ornate, red and gold lettering, casting subtle shadows to give it a three-dimensional effect against the starry backdrop. Directly beneath this, the subtitle, ""THE LION, THE WITCH AND THE WARDROBE,"" appears in an elegant, hand-lettered script of a lighter, aged gold, spanning across the poster just above the lion's brow.

The composition arranges various key characters around and below the lion. To the left, two of the Pevensie children, a boy with a sword and a girl with a bow and arrow, are positioned in dynamic poses, ready for action, partially obscured by the lion's mane, while another child is visible lower left. On the opposite side, towards the lower right, a young girl stands beside a snow-covered lamppost, which glows warmly, casting light on the pristine snow. In the bottom center, the formidable White Witch is dramatically depicted in her ice sleigh, pulled by ferocious polar bears that surge through the snow, conveying a sense of chilling momentum and menace. Above the left cluster of children, two eagles soar through the air, adding to the epic scope.

The lighting throughout the poster is ethereal and magical, emanating from various sources. The lion's eyes appear to glow from within, and the lamppost emits a bright, warm yellow light that illuminates its immediate surroundings. A soft, diffuse light bathes all the characters, highlighting details on their clothing, weapons, and the snowy environment, creating gentle gradients rather than harsh shadows. The overall impression is one of a magical, starlit world, with countless tiny points of light sparkling across the dark background, resembling either stars or falling snow.

The color palette is dominated by cool, deep tones of teal, dark blue, and forest green in the upper background, which transitions to lighter, frosty blues and whites at the bottom, signifying the icy landscape of Narnia under the White Witch's reign. These cool colors are dramatically contrasted by the warm, golden-orange and brown hues of the lion's fur and the rich, metallic reds and golds of the main title. Accent colors include the vibrant emerald green of the lion's eyes, the bright yellow of the lamplight, and the stark white of the snow and the polar bears, with a striking splash of red on the boy's shield.

The emotional mood and atmosphere of the poster are profoundly enchanting, blending wonder, epic adventure, and a hint of impending danger. The lion’s serene yet powerful presence inspires awe and a sense of guardianship, while the children's determined expressions convey courage and a spirit of heroism. The White Witch's imposing figure and her polar bear-drawn sleigh introduce a chilling element of conflict and the harshness of her reign, creating a compelling balance between hopeful fantasy and challenging adversity. The magical glow and starry background further evoke a grand, otherworldly saga.

The key iconic visual symbol that defines this poster is undeniably the magnificent, wise face of Aslan, the lion. His imposing size and central placement, combined with his piercing, glowing emerald eyes, serve as the ultimate representation of the film's magic, power, and central themes of guidance and sacrifice within the fantastical world of Narnia."
671,Harry Potter and the Philosopher's Stone,/wuMc08IPKEatf9rnMNXvIDxqP4W.jpg,"The movie poster for ""Harry Potter and the Philosopher's Stone"" unfolds with a rich tapestry of characters and magical elements, all unified by a distinct, enchanting aesthetic. At its heart, the composition centers on a young Harry Potter, whose face, framed by his iconic round glasses, is prominently displayed in the mid-foreground, slightly to the right, his earnest blue eyes gazing thoughtfully to the left. He is positioned against a backdrop that gradually deepens into a magical world. Above him, on the left, perches the majestic, gothic silhouette of Hogwarts Castle, its towers reaching towards a dark, cloud-strewn sky, while to the right, a luminous white owl, Hedwig, glides through the air.

The ensemble of supporting characters is thoughtfully arranged around Harry, creating a sense of depth and narrative importance. In the lower left quadrant, Albus Dumbledore, with his distinctive long white beard and a richly patterned maroon robe, looks forward with serene wisdom, positioned above Hermione Granger, who holds a stack of books, and Ron Weasley, who stands beside her with arms crossed, both looking slightly up. To the right of Harry, partially obscured by an ethereal mist, stands the towering figure of Hagrid, holding a glowing lantern, his gaze directed towards the left. Further down, at the bottom of the poster, Severus Snape's stern visage and flowing black robes command attention in the center-left, flanked by Minerva McGonagall in her pointed hat and dark green attire, while the Hogwarts Express train, with its prominent ""5972"" number plate and ""HOGWARTS EXPRESS"" text, chugs into view from the bottom right, emitting soft steam. Various floating, luminous candles dot the mid-ground near Hogwarts, adding to the magical ambiance, while a dark, misty forest frames the space behind Hagrid.

The lighting throughout the poster is predominantly soft and ethereal, suggesting an otherworldly glow rather than a harsh, directional source. A mystical, diffused light bathes Harry's face and illuminates Dumbledore's features and beard, highlighting their prominence. Shadows are gentle, serving to define contours and add depth to the robes and structures without creating stark contrasts. The background elements, such as the castle and forest, are more subtly lit, allowing the foreground figures to emerge with greater clarity. Hagrid's form is mostly shrouded in shadow, but the warm, inviting glow of his lantern provides a key accent light, drawing the eye.

The color palette is dominated by cool tones, primarily deep blues and blacks in the expansive night sky, which gradually lighten into a mysterious, misty turquoise and ethereal blue towards the foreground. This cool base provides a dramatic canvas for the carefully selected accent colors. Rich maroon on Dumbledore's robes, earthy browns and greens on Hagrid's coat, and the vibrant red and gold of the Hogwarts Express punctuate the scene with warmth and visual interest. Harry's subtle gold-and-blue tie against his uniform also adds a touch of color, while the brilliant white of Hedwig and the glowing yellow-white of the floating candles and train windows provide luminous highlights. This interplay of cool depths and warm accents creates a visually captivating and balanced image.

An emotional mood of wonder, adventure, and a hint of underlying solemnity pervades the poster. The mystical blue lighting and the iconic elements like Hogwarts Castle and the floating candles evoke a strong sense of enchantment and magic, inviting the viewer into a fantastical world. Harry's serious, somewhat wide-eyed expression, combined with the sternness of Snape and the wisdom of Dumbledore, suggests a journey fraught with both discovery and significant challenges. The overall atmosphere is one of hopeful destiny mingled with a touch of the unknown, characteristic of a grand epic beginning.

The typography is strikingly integrated into the top portion of the poster. The main title, ""Harry Potter,"" appears in a large, metallic, and somewhat jagged serif font that exudes an ancient, almost carved stone quality, with its letters colored in a gleaming silver-grey. Directly below and to the right, in a smaller, more refined serif font, is the subtitle ""AND THE PHILOSOPHER'S STONE,"" presented in a soft white, aligning with the right edge of the main title. Both text elements are positioned against the darkest part of the sky, ensuring maximum readability. A subtle yet effective interaction occurs as the sharp, descending serif of the second ""t"" in ""Potter"" points gently towards Harry's head, creating an understated visual connection between the title and its central protagonist.

The key iconic visual symbol that powerfully defines this poster is Harry Potter's face and his round glasses. Positioned centrally and prominently, his youthful yet determined expression, immediately recognizable by his distinctive eyewear, acts as the focal point and the primary identifier of the film. His direct, thoughtful gaze, combined with his central placement among the unfolding magical world, instantly communicates the subject and protagonist of this enchanting story."
