id,title,poster_path,poster_caption
198663,The Maze Runner,/ode14q7WtDugFDp78fo9lCsmay9.jpg,"This movie poster for ""The Maze Runner"" presents a striking and atmospheric composition, centered on a trio of young men framed by the towering, ancient walls of a colossal maze. The main character, a young man with dark, tousled hair, dominates the foreground, positioned slightly to the left of the central vertical axis. He faces intently towards the right, his gaze fixed off-frame, conveying a sense of determined caution. Behind him and slightly to his left, another young man with light, sandy hair emerges from the gloom, holding a rough wooden staff, his expression watchful as he also looks right. To the main character's right, further back and partially obscured by his body, a third young man with dark hair looks directly out at the viewer, holding a small axe, his face etched with a look of concern or resolve. All three are clad in worn, utilitarian clothing, hinting at arduous survival.

The lighting is dramatic and high-contrast, with a brilliant, diffuse light source emanating from the upper left background, as if a powerful sunbeam or an opening in the maze ceiling illuminates their path. This light strongly highlights the left sides of the characters, particularly the central figure's face and shoulder, creating a stark contrast with the deeper shadows that define the right side of his body and the more distant elements. The environment itself is bathed in this dramatic interplay of light and shadow, with pockets of misty brightness cutting through the oppressive darkness of the ancient structures and dense, overgrown foliage.

The color palette is predominantly cool and desaturated, dominated by rich, deep greens and teals from the surrounding vegetation and weathered stone, along with cool greys and subtle blues in the distant haze. These cooler tones are sharply punctuated by the warm, golden glow of the primary light source, which adds an accent of hopeful intensity to the illuminated areas of the characters and background. The muted earthy tones of their clothing—greys, tans, and dull greens—blend seamlessly with the environment, yet their faces are lit to stand out against the backdrop.

The overall emotional mood is one of intense tension, adventure, and foreboding. The characters' expressions and the looming, seemingly inescapable maze walls create an atmosphere of peril and urgency, suggesting a journey fraught with danger and the relentless pursuit of an unknown objective. There is a palpable sense of being trapped within a vast, hostile environment, yet also an underlying current of determined survival and collective resolve.

The movie title, ""THE MAZE RUNNER,"" is prominently displayed in the lower-middle section of the poster. ""THE"" is in a smaller, simple sans-serif font positioned directly above the main title. ""MAZE RUNNER"" is rendered in a large, imposing, metallic silver-grey sans-serif font with sharp, angular cuts, particularly evident in the ""A"" (whose crossbar is an inverted V) and the sharp terminals of the ""E""s and ""R""s. The text appears textured, suggestive of brushed steel or weathered concrete. It is strategically placed to overlap the central character's lower torso and legs, subtly integrating the typography with the subject while maintaining its readability and prominence. The metallic sheen of the title reflects the cool ambient light of the poster.

The defining iconic visual symbol of this poster is undoubtedly the **towering, colossal maze walls**. These immense, overgrown structures loom over the characters, framing them within a sense of oppressive enclosure and emphasizing the monumental challenge they face. Their verticality and the way they recede into the misty distance encapsulate the central premise of confinement and the vast, mysterious world the characters inhabit."
1422096,Good Boy,/daInKxjoRNLFWIus64fHAy91V0k.jpg,"The movie poster presents a stark and emotionally charged scene, dominated by a strong diagonal composition that draws the eye into a narrative of vulnerability and pursuit. A lone, medium-sized dog, with a distinctive coat of browns, tans, and white, is positioned in the upper right, appearing to walk downwards and towards the left, its head slightly bowed. Directly beneath it, a long, dark, and somewhat blurred shadow extends diagonally across the mid-ground, mirroring the dog's path. From the deep, shadowy abyss that occupies the bottom and left portions of the frame, a multitude of elongated, gnarled hands emerge, reaching upwards and outwards with an almost desperate, clawing motion, seemingly grasping towards the descending dog. This arrangement creates a powerful sense of imminent contact or escape, with the dog positioned precariously above the swirling mass of shadowy forms.

The lighting throughout the poster is dramatic and serves to heighten the emotional tension. An unseen light source from the top-right casts a prominent, sharp shadow from the dog, which acts as a visual bridge, hinting at a connection to the darker forms below. The many hands and the amorphous shapes from which they extend are rendered almost entirely in deep silhouette, devoid of internal detail, emphasizing their mysterious and menacing nature as they rise from profound darkness. A subtle, ethereal glow emanates from around the dog's eyes and forepaws, hinting at a unique quality or inner light.

The color palette is minimalist yet deeply evocative, built on a foundation of cool tones and high contrast. The upper sky portion of the poster features a desaturated, dusty blue-grey, a muted teal that gradually deepens into an inky black towards the bottom where the shadowy hands reside. The hands themselves are rendered in absolute black, creating a powerful void and intensifying their sinister presence. The dog introduces the warmest colors to the composition, with its fur displaying a rich array of earthy browns, tans, and creamy whites, providing a focal point of organic life against the cool, dark background. The subtle glowing accents on the dog's eyes and paws are a pale, almost phosphorescent blue, harmonizing with the overall cool palette.

The overall emotional mood is one of profound dread, vulnerability, and suspense. The dog's solitary descent and its downcast gaze convey a sense of melancholy or quiet resignation, while the sheer number and desperate reach of the shadowy hands evoke a primal fear of being overwhelmed or consumed. A palpable tension is created by the close proximity of the lone, seemingly innocent animal to the multitude of menacing, faceless entities, suggesting a struggle for survival against an inescapable, lurking threat. The quiet narrative of the dog's journey combined with the chaotic, grasping hands establishes a deeply unsettling and suspenseful atmosphere.

The typography for the title, ""GOOD BOY,"" is positioned clearly in the lower central part of the poster, within the deep black area but subtly interacting with the lighter blue-grey background. The text is rendered in an elegant, classic serif font, capitalised and slightly distressed, lending it a timeless, perhaps ancient, quality. Its color is a delicate, pale blue-grey, perfectly matching the lighter hues of the sky, visually integrating the text into the poster's environment without being overshadowed by the intense imagery above. The clean spacing ensures readability while maintaining an understated sophistication.

The key iconic visual symbol that defines this poster is the striking contrast between the single, vulnerable, and somewhat melancholic dog descending into a world populated by a multitude of shadowy, clawing hands. This powerful juxtaposition of a solitary, living creature against an overwhelming, faceless threat encapsulates themes of innocence encountering malevolence, a singular beacon facing an engulfing darkness, and a potential journey into sacrifice or the unknown, making it instantly recognizable and profoundly impactful."
1022787,Elio,/7z8jDiTZZco9moIKpTUImFtTy7o.jpg,"The poster unfolds with a captivating sense of otherworldly wonder, dominated by a nocturnal landscape beneath a vast, star-dotted sky. In the upper right quadrant, a powerful, radiant beam of ethereal blue light descends diagonally, originating from an intricate, glowing geometric structure that hints at an alien vessel or portal. Suspended within the luminous column, a young boy with dark hair and a look of wide-eyed astonishment floats horizontally, his body angled as if gently ascending or descending. He wears simple shorts and a t-shirt, clutching a small, rectangular device, adding to his contemporary yet fantastical predicament. Below this celestial spectacle, a rugged, dark rocky coastline juts into the mid-ground on the left, its craggy silhouette softened by the faint ambient light. Gentle waves lap against a dark, sandy beach that stretches across the entire foreground, creating a grounding anchor for the extraordinary events unfolding above.

The lighting throughout the scene is primarily characterized by the intense, glowing quality of the alien beam, which saturates the boy and the immediate area around him in brilliant blue and white light, casting soft, indistinct rays onto the dark ocean surface below. Beyond the beam's direct illumination, the overall environment is bathed in the subtle, deep blues of twilight and starlight, with countless tiny pinpricks of white stars scattered across the sky. Shadows are largely absent in the illuminated areas, instead defined by the deep, rich indigo and navy hues of the unlit portions of the sky, ocean, and rocky landmass, creating a stark contrast between the intense light and the mysterious darkness. The water itself reflects a muted version of the sky's deep blue, with hints of turquoise where the light catches the gentle ripples.

The color palette is overwhelmingly cool and dark, dominated by a spectrum of deep blues, from the nearly black shades of the foreground beach and the shadowed parts of the rock, to the vibrant indigos and purples of the night sky and ocean. The brilliant, glowing light beam provides a striking accent, shimmering in intense blues, white, and soft purples. The boy's clothing features subtle earth tones like muted greens and browns, which stand out softly against the surrounding light. The dominant hue of the ""ELIO"" title is a gradient of lavender and softer purples, perfectly complementing the cool tones of the sky and light beam.

An emotional mood of profound mystery and awe permeates the poster, evoking a sense of innocent discovery and the unknown. The boy's expression and posture convey both surprise and a certain wonder, inviting the viewer to share in his extraordinary experience. There's a peaceful yet dramatic atmosphere, suggesting a pivotal moment of encounter with something vast and beyond human comprehension, all set against the tranquil beauty of a starlit night. It hints at a journey into the cosmos, filled with both apprehension and excitement.

The typography for the film's title, ""ELIO,"" is boldly positioned at the very bottom of the poster, stretching across the dark sandy beach. The font is modern, rounded, and sans-serif, rendered in a striking gradient that shifts from a deeper purple on the left to a lighter, almost glowing lavender-blue on the right. The letters are all lowercase except for a subtly stylized 'L', and the dot of the 'i' is replaced by a distinctive graphic symbol: a small, vibrant orange circle orbited by a thinner, light blue ring. This logo interacts directly with the environment, appearing to rest on the sand, its smooth, solid form providing a strong visual base for the more ethereal action above.

The single key iconic visual symbol that defines this poster is the luminous, diagonal beam of light, originating from the unseen celestial body at the top right and drawing the viewer's eye directly to the central figure of the boy. This beam is not merely light; it is the conduit of wonder, the gateway to the unknown, and the active element that transforms a serene nightscape into a scene of extraterrestrial contact and adventure."
1248226,Playdate,/fGodXWqJkkkbSebPIlxLSygV8GY.jpg,"The movie poster for ""PLAYDATE"" immediately commands attention with its dynamic and chaotic composition, centered around a massive, fiery explosion in a seemingly ordinary suburban street. Four distinct figures, two adult men and two young boys, stride purposefully forward from the midground towards the viewer, appearing remarkably composed despite the unfolding pandemonium directly behind them. On the far left, a boy in a vibrant red hoodie and jeans walks with casual confidence, followed by a man sporting a green jacket, black cap, and jeans, who holds a pistol pointed downwards in his right hand. To his right, a second, more muscular man in a grey Henley shirt and cargo pants also carries a pistol, and tenderly holds the hand of the second young boy, who is dressed in a light blue polo and a light grey jacket.

The quality of lighting is intensely dramatic, largely dictated by the colossal, bright yellow and orange explosion that forms the backdrop. This inferno acts as a powerful backlight, creating strong rim lighting around the silhouettes of all four figures, making them pop against the luminous chaos. Despite the dominant backlight, their front profiles are also well-illuminated, suggesting either significant ambient light reflection from the fiery scene or a subtle frontal light source, ensuring their features are clear. Shadows under their feet are present but not overly harsh, contributing to a high-key, energetic feel. Above the explosion, the sky transitions to a clear, bright blue, offering a cool contrast to the warmth below.

The overall color palette is a vibrant study in contrasts. Dominant warm hues of fiery orange, yellow, and deep red from the explosion and autumn-toned background trees clash spectacularly with the crisp, cool blue of the sky. Earthy tones are present in the characters' clothing – muted greens, greys, and browns – grounding the scene. However, the scene is liberally accented with playful, primary-colored bouncing balls (red, blue, yellow, pink, green) scattered both mid-air within the explosion's debris and on the asphalt street, alongside a lone soccer ball and a burning tire in the lower right. The red hoodie on the leftmost boy provides another strong, eye-catching accent.

An intriguing emotional mood emanates from the poster, blending intense action with an almost surreal, lighthearted detachment. The epic explosion, flying debris, and armed adults suggest high-stakes danger and thrilling chaos, yet the subjects' collected demeanor, walking away without a glance back, injects a sense of cool confidence and even humor. The presence of young children and scattered toys amidst such destruction, paired with the title ""PLAYDATE,"" strongly hints at an action-comedy, creating an atmosphere that is both exhilarating and playfully absurd.

The movie title, ""PLAYDATE,"" is prominently displayed in the lower center of the poster, rendered in bold, three-dimensional metallic silver block letters. These letters possess a textured, slightly worn surface and a noticeable bevel, conveying a sense of weight and resilience. The typography is positioned on the asphalt street, beneath the feet of the walking figures, and is angled slightly to match the perspective of the ground, appearing as though viewed from a low angle. The text occupies a clear space, neither overlapping with nor obscuring any of the characters, ensuring its legibility and serving as a solid visual anchor for the composition.

The key iconic visual symbol that defines this poster is undoubtedly the **airborne, bullet-riddled, upside-down beige minivan, suspended amidst the fiery explosion, surrounded by a whimsical flurry of colorful bouncing balls.** This single image perfectly encapsulates the poster's unique fusion of suburban normalcy, unexpected high-octane action, and a distinct vein of playful, child-like chaos, immediately communicating the movie's genre and tone."
346364,It,/9E2y5Q7WlCVNEhP5GiVTjhEhx1o.jpg,"This haunting movie poster plunges the viewer into a deep, pervasive darkness, punctuated by a few stark, resonant elements. The composition is deliberately structured to evoke a sense of foreboding, with a small child in a bright yellow raincoat positioned at the bottom center, back to the viewer, appearing to walk into the frame from the lower edge. Their stance, slightly angled to the right, draws the eye forward into the abyss ahead. Looming subtly in the mid-ground on the left, a dimly visible figure, barely discernible through the gloom, extends a pale, ruffed hand upward, clutching the string of a vibrant, glossy red balloon that floats prominently in the upper-left quadrant. To the right of the balloon, emblazoned against the oppressive darkness, is the blood-red, stylized title ""IT,"" its letters appearing to be painted or dripping with a viscous, unsettling liquid. The ground beneath the child is a dark, wet, and reflective surface, mottled with scattered puddles that mirror the faint light and create subtle, distorted reflections.

The entire scene is enveloped in a low-key, dramatic lighting scheme, with primary light sources seeming to emanate from an unseen point above and slightly ahead of the child, casting soft, diffused illumination that highlights the child's bright raincoat and the reflective wet ground. Shadows are deep, absolute, and stretch endlessly into the background, contributing heavily to the poster's profound sense of mystery and dread. The faint figure of the clown, Pennywise, is barely touched by light, existing more as a spectral presence within the surrounding gloom, its extended hand and the balloon serving as its most defined features. The ""IT"" title, though glowing with an internal red luminescence, is also framed by dense shadow, enhancing its sinister impact.

The color palette is dominated by an overwhelming expanse of dark grays and blacks that define the atmosphere and background, creating a visual void. Against this oppressive backdrop, several vivid accent colors leap out with striking intensity. The child's raincoat is a brilliant, almost defiant yellow, a stark contrast to the darkness that surrounds them. The primary accent of horror is the deep, rich, and glossy red of the balloon, matched by the arterial red of the stylized ""IT"" title, which appears to shimmer with a malevolent glow. Further accenting the child's figure are the muted, deep green rubber boots, providing a small anchor of earthly color. The faint details of Pennywise's costume, visible as desaturated whites and grays, only add to the spectral quality of its appearance.

An intense emotional mood of eerie suspense and palpable dread permeates the poster. There is a profound sense of childlike vulnerability confronting an unknown and terrifying evil. The atmosphere is one of chilling isolation and impending horror, underscored by the vast, smoky darkness, the wet, desolate street, and the silent, lurking presence. The child's posture of walking away, their back to the viewer, invites identification and amplifies the feeling of being drawn into a dangerous situation, while the barely visible monster hints at unseen terrors just beyond the immediate frame.

The typography consists solely of the film's title, ""IT,"" rendered in a distinctive, jagged, and somewhat organic blood-red font. It is positioned in the upper right-hand corner, floating against the dark background. The letters appear distressed and perhaps dripping, as if formed from blood or some viscous substance, giving them a menacing, almost visceral quality. Its placement is high enough to be distinct from the subjects, yet visually connected to the sinister red of the balloon, solidifying its thematic link to the lurking horror without directly overlapping any figures.

The single most iconic visual symbol that defines this poster is unequivocally the glossy red balloon. It is not merely an accessory but a primary focal point, glowing vibrantly against the dark and serving as the direct link between the partially obscured monstrous figure and the innocent child. Its bright, appealing color belies its sinister association, making it a powerful and instantly recognizable emblem of the film's underlying horror and malevolent presence."
1116201,Iron Lung,/sIwakdbMGS1krtgendTWpxTY9Hw.jpg,"This striking movie poster immediately immerses the viewer in a chilling and oppressive atmosphere, dominated by deep blacks and stark, monochrome textures, accented only by a visceral red title. The vertical composition is cleverly divided into three distinct horizontal zones: menacing organic and skeletal forms at the top, the bold title at the center, and equally threatening elements at the bottom, creating a powerful sense of being trapped or consumed.

At the uppermost section, a grisly, bone-like structure is visible, featuring what appears to be a rudimentary skull and a spine with elongated, sharp, rib-like protrusions that curve downwards, resembling the upper jaw or teeth of some monstrous entity. Below this, a dense array of razor-sharp, spear-like spikes emerges from an organic, textured mass, pointing downwards towards the center of the poster. The lower section mirrors this macabre imagery, presenting another mass of similar sharp, upward-pointing spikes and organic matter that seem to form a complementary lower jaw, leaving a dark, gaping void between the two predatory forms.

The lighting is intensely dramatic and high-contrast, casting severe shadows that plunge the background into absolute blackness. Bright, almost glowing white highlights sharply delineate the contours of the bones and spikes, making them appear incredibly sharp and three-dimensional, as if illuminated by a harsh, unseen light source directly from above and below. These stark highlights against the deep shadows create a grim, almost forensic clarity to the terrifying details of the creature, emphasizing its skeletal, predatory nature.

The overall color palette is minimalistic and impactful. Deep, absolute black dominates the canvas, serving as both background and the darkest shadows within the creature's forms. The creature itself is rendered in a stark grayscale, from brilliant whites on the pointed elements to varying shades of dark gray on the textured, organic material, which gradually fades into the pervasive black. The sole splash of color is found in the title text, a muted, rusty red, reminiscent of dried blood, providing a potent accent that intensifies the poster's gruesome tone.

An overwhelming sense of dread, horror, and claustrophobic danger pervades the image. The sharp, skeletal forms evoke mortality and aggression, while the enveloping blackness suggests an abyss of unknown terror. The composition, with the title seemingly caught between these two monstrous jaws, conjures a mood of inevitable peril and struggle, leaving the viewer with a profound feeling of unease.

The title, ""IRON LUNG,"" is centrally positioned, uppercase, and rendered in a rugged, sans-serif font. Each letter appears heavily distressed and cracked, as though made of corroded metal or decaying stone, enhancing the gritty and severe aesthetic. The muted red color of the text, with its slightly smoky edges, gives it a haunting glow against the surrounding black, making it stand out as the narrative's focal point. Its precise placement directly between the two imposing creature elements makes it integral to the narrative suggested by the visual, appearing simultaneously central and endangered.

The single key iconic visual symbol that defines this poster is the colossal, abstract maw formed by the two opposing sets of sharp, skeletal spikes and organic masses. This symbolic open jaw, poised to crush or consume the title, perfectly encapsulates the theme of inescapable horror and imminent danger that is central to the poster's chilling appeal."
